created_utc,title,self_text,subreddit
1688464314.0,Taliban ban women's beauty salons in Afghanistan,,worldnews
1710407834.0,Paris mayor wants Russian athletes banned from Olympics,,worldnews
1682442596.0,Trudeau says Canada is 'very serious' about reviving nuclear power,,worldnews
1701594109.0,Kyiv Confirms Russian Troops Executed Two Ukrainian Soldiers Upon Surrender,,worldnews
1709301956.0,Putin allies tell Macron: Any French troops you send to Ukraine will suffer fate of Napoleon's army,,worldnews
1696687346.0,Pentagon says it will support Israel after Netanyahu declares war,,worldnews
1695972260.0,Canadian police won't investigate doctor for sterilizing Indigenous woman,,worldnews
1710271480.0,"Mexican detectives searching for 43 missing students have disappeared, president says",,worldnews
1690046101.0,U.S.-Sanctioned Russian Millionaire Found Dead In His Moscow Office,,worldnews
1696971156.0,"Doctors Without Borders: "" Hospitals are overwhelmed in ‘catastrophic situation’ in Gaza""",,worldnews
1698994536.0,"Over 8,000 rockets fired, 250,000 Israelis evacuate from their homes: IDF",,worldnews
1698163174.0,"UN chief Antonio Guterres says Hamas massacre ""didn't happen in a vacuum""",,worldnews
1709723139.0,US says no troops to Haiti as country reels from explosion of gang violence,,worldnews
1706954721.0,Major Russian Oil Refinery in Volgograd Region Falls Victim to a Drone Attack,,worldnews
1693281188.0,Ukrainian military destroy unique Russian radar station worth $200 million in Kherson Oblast,,worldnews
1680747154.0,"China to inspect ships in Taiwan Strait, Taiwan says won't co-operate",,worldnews
1711443517.0,"Hamas rejects US hostage deal compromise, 'doesn't meet demands'",,worldnews
1692632921.0,"US Embassy in Minsk says U.S. citizens in Belarus should depart immediately. Citizens who will travel to Belarus need ""contingency plan that does not rely on U.S. government assistance""",,worldnews
1693034586.0,"Kyiv Confirms Black Sea Fleet Attack, Warns Moscow of More ‘Surprises’",,worldnews
1686399432.0,Canadian Prime Minister Trudeau arrived on an unannounced visit to Kyiv,,worldnews
1700520606.0,"'Argentina has non-negotiable sovereignty over the Falklands', country's new right-wing president Javier Milei declares",,worldnews
1681903342.0,South Korea could provide military aid to Ukraine if Russia targets civilians,,worldnews
1703600041.0,China’s Xi Jinping says Taiwan reunification will ‘surely’ happen as he marks Mao Zedong anniversary,,worldnews
1693656006.0,"Nobel Foundation cancels Russia, Belarus, Iran invites to annual prize awards",,worldnews
1687698561.0,"Russians check teenagers in Mariupol for ''loyalty to Ukraine'' - Russians hold ""preventive talks"" with children, where they demand they report ""unreliable companions"".",,worldnews
1709924663.0,Latvia orders first Russians to leave country,,worldnews
1689946408.0,Putin tells Poland any aggression against Belarus is attack on Russia,,worldnews
1692291943.0,"Ocean cleanup group removes record 25,000 pounds of trash from Great Pacific Garbage Patch in one extraction",,worldnews
1690569996.0,African leaders press Putin to end Ukraine war and restore grain supplies,,worldnews
1681749828.0,"Russian spies are using Tinder to ensnare German soldiers and politicians to get them to disclose Ukraine war secrets, counterintelligence warns",,worldnews
1688943269.0,Mormon Church walks away from major multinational tax evasion scheme,,worldnews
1682725803.0,An Ominous Heating Event Is Unfolding in the Oceans,,worldnews
1710271509.0,Furious Hungary summons US envoy over Biden’s ‘dictatorship’ comment,,worldnews
1710947845.0,Palestinians demolish Jewish archaeological site in West Bank,,worldnews
1687634364.0,Wagner Group fighters prepare to leave the centre of Rostov-on-Don,,worldnews
1685457435.0,Japanese court rules against same-sex marriage ban in major win for LGBTQ+ equality,,worldnews
1686141411.0,Thai PM frontrunner vows to legalise same-sex marriage: ‘Love must win’,,worldnews
1700422354.0,Palestinian Authority denies Hamas music festival massacre,,worldnews
1692814322.0,Hundreds of Wagner Men Vanish From Putin’s Designated Exile,,worldnews
1711193029.0,"Mexico's president says he won't fight drug cartels on US orders, calls it a 'Mexico First' policy",,worldnews
1687714460.0,Wagner chief accused of 'cowardice' for ordering troops to halt Russia march,,worldnews
1689535781.0,"Zelenskyy: When Ukraine's air defence becomes strong enough, we will protect the whole Europe",,worldnews
1684720446.0,A series of leaks from the Russian aviation industry has uncovered the industry’s negligence in ensuring safety since sanctions were imposed,,worldnews
1708908954.0,"Sell homes of 'Putin cronies', says London mayor",,worldnews
1705084540.0,Houthis mistakenly target tanker carrying Russian oil - Ambrey report,,worldnews
1696240062.0,‘We can’t do it alone’: Ukrainians react to lack of additional funding in US spending bill,,worldnews
1703874538.0,Biden on Russia’s aerial attacks on Ukraine: Putin ‘must be stopped’,,worldnews
1705332411.0,Tibetan woman detained and beaten for social media posts critical of China,,worldnews
1708021904.0,"Ukraine's Zelensky signs medical marijuana bill, a step he says can heal 'pain, stress and trauma of war' with Russia",,worldnews
1704472327.0,"Kremlin launches campaign to meddle in U.S. election, as GOP ends support for Ukraine",,worldnews
1694066377.0,"'Russian Flag Cannot Be At Paris Olympics,' Macron Says",,worldnews
1699810164.0,Hamas blocks IDF fuel delivery to Gaza's Shifa Hospital,,worldnews
1681501864.0,Nato ships dock in Helsinki for first time since Finland's accession,,worldnews
1702547072.0,"Russian Soldiers Seen Using Ukrainian Troops as Human Shields, One Shot Dead",,worldnews
1697821292.0,Hamas releases two US hostages 'for humanitarian reasons' in response to Qatari efforts -spokesperson,,worldnews
1707636881.0,Madagascar Passes Bill To Castrate Child Rapists,,worldnews
1699136817.0,Zelensky says Israel-Gaza conflict taking focus away from fighting in Ukraine war,,worldnews
1709939571.0,"Trudeau says some Pro-Palestinian protests cross the line into hate, harassment",,worldnews
1691318759.0,A flightless parrot is returning to mainland New Zealand after a 40-year absence,,worldnews
1711963786.0,Hamas slashes food prices as Gaza flooded with humanitarian aid,,worldnews
1692445087.0,Ecuador prepares for ‘once-in-a-lifetime’ vote to stop oil drilling,,worldnews
1685178899.0,"Report: ‘massive’ Tesla leak reveals data breaches, thousands of safety complaints | Tesla",,worldnews
1710446045.0,Macron says Russian victory in Ukraine 'would reduce Europe's credibility to zero',,worldnews
1711356280.0,"Hamas, Al Jazeera admit: Story of IDF rapes in Gaza hospital fabricated",,worldnews
1695868710.0,"Microplastics Are Present In Clouds, Confirm Japanese Scientists",,worldnews
1687189971.0,Russia reportedly tried to assassinate a high-value CIA asset in Miami,,worldnews
1686246924.0,"Around 40 standing stones thought to have been erected by prehistoric humans 7,000 years ago have been destroyed near a famed archaeological site in northwest France to make way for a DIY store",,worldnews
1707994851.0,Putin on war against Ukraine: We regret not starting it earlier,,worldnews
1685021541.0,EU Declares No Longer Dependent on Russian Energy,,worldnews
1710495653.0,We are ready: Macron responds to Putin's nuclear threats,,worldnews
1701779101.0,"IDF officials: 15,000 likely killed in Gaza since start of war, 5,000 of them are Hamas",,worldnews
1700600875.0,"US forces attacked at Iraq air base, respond in self-defence",,worldnews
1699099369.0,"Exhausted and disappointed with allies, Ukraine’s president and military chief warn of long attritional war",,worldnews
1698872351.0,"In battle for Gaza stronghold, 100 women and children pushed forward by Hamas to act as human barrier",,worldnews
1693418851.0,White House says Putin and Kim Jong Un traded letters as Russia looks for munitions from North Korea,,worldnews
1685279840.0,Lukashenko says Putin to give nuclear weapons to anyone who joins Union State,,worldnews
1685097728.0,Medvedev declares war in Ukraine would last for decades and threatens with nuclear strike again,,worldnews
1712071698.0,"NATO Proposes $100 Billion, Five-Year Fund to Support Ukraine",,worldnews
1687563172.0,Wagner boss Yevgeny Prigozhin says his mercenaries are marching into Russia,,worldnews
1693054656.0,Moscow was again forced to shut down its major airports after Ukraine drones again targeted Russia's capital,,worldnews
1701408827.0,"Truce ends, fighting in Gaza resumes; IDF says Hamas violates terms after rocket fire",,worldnews
1697991104.0,"Al-Qaida and IS call on followers to strike Israeli, US and Jewish targets",,worldnews
1689952173.0,Egypt Criticizes Russia for Ending Ukraine Grain-Export Deal.,,worldnews
1689452873.0,Ukraine Rejects Bulgarian President’s Claims That Kyiv Is to Be Blamed for Russia’s Ongoing War,,worldnews
1696790105.0,"Russian hacker group ""Killnet"" declares cyberwar on Israel | Al Bawaba",,worldnews
1707857465.0,Russia warns the West: we will be very tough if you 'steal' our assets,,worldnews
1701878073.0,US Files War Crime Charges Against Russian Troops Accused of Torturing an American in Ukraine,,worldnews
1694991875.0,"Kenyan senator and period poverty activist Gloria Orwoba: ‘Some girls exchange sex for pads’: The lawmaker was asked to leave Parliament in February after arriving with blood-stained pants, in a country where 65% of women cannot afford menstrual products",,worldnews
1681026029.0,"India releases tiger census data: 3,167 tigers in 2022, up from 2,967 in 2018",,worldnews
1711329788.0,"Russia warns Japan on missile transfer to Ukraine, threatens ties",,worldnews
1702914709.0,5 million shekels ($1.5M) in cash found in senior Hamas member's home,,worldnews
1705017095.0,U.S. and Britain launch strikes against targets in Houthi-controlled Yemen,,worldnews
1708789802.0,Navalny's mother given her son's body after more than a week of waiting,,worldnews
1708777076.0,Hamas’s ‘sadistic sex crimes’ on Oct. 7 set forth in new report,,worldnews
1695470160.0,"Africa’s rhino population rebounds for 1st time in a decade, new figures show",,worldnews
1710004504.0,"1,000 US troops deploying to build offshore port for Gaza aid",,worldnews
1686561152.0,"Ukraine loses 16 US-made armored vehicles, group says, but Kyiv's forces still gain territory | CNN",,worldnews
1697824523.0,Israel Closes Al Jazeera Facilities,,worldnews
1694959122.0,"‘Prepare For a Long War’ – NATO Chief Issues Stark Warning, Says Ukraine Will Join Alliance ‘Eventually’",,worldnews
1697571960.0,"Gaza hospital hit by failed Islamic Jihad rocket, says IDF",,worldnews
1706622640.0,Hamas command center found under cemetery Israel accused of desecrating,,worldnews
1708650280.0,"Kremlin threatens to let Navalny’s body rot unless he is buried in secret, says family",,worldnews
1705179219.0,Two Navy SEALs are missing after Thursday night mission off coast of Somalia,,worldnews
1685106375.0,"7,000 year-old road found under the Mediterranean Sea in Croatia",,worldnews
1697455103.0,France to screen foreigners with radical record for possible expulsion,,worldnews
1695128440.0,Russian soldiers say they dream of conquering Ukrainian cities and moving their families there in haunting recruitment ad,,worldnews
1703008513.0,"Zelensky: Military proposed to mobilize 450,000-500,000 soldiers",,worldnews
1705948879.0,Mega-rich renew call on global leaders at Davos to 'tax our extreme wealth',,worldnews
1709856426.0,US says Hamas holding up 6-week ceasefire by refusing to release vulnerable hostages,,worldnews
1710045927.0,Treason charges after $50 for Ukraine: desperate battle to free LA ballerina held in Russia,,worldnews
1681734138.0,Dutch intelligence agency warns conspiracy theories pose ‘serious threat’,,worldnews
1708632411.0,"Russia threatens to shoot aircraft patrolling Black Sea, claims France",,worldnews
1699097710.0,IDF says ambulance attacked in Gaza transported Hamas terrorists and weapons,,worldnews
1689046938.0,Russia launches air attack on Kyiv hours before NATO summit,,worldnews
1682169747.0,Singapore to execute man over 1 kg of cannabis,,worldnews
1681321323.0,Polish media claims France is blocking EU decision on financing ammunition supplies to Ukraine,,worldnews
1687886709.0,Putin claims Wagner militants were fully funded by state and had received $1 billion between May 2022 and May 2023,,worldnews
1709208992.0,IDF says it fired on Gazans who endangered troops in stampede; Hamas claims 70 dead,,worldnews
1704821421.0,BBC apologizes for running Hamas claim IDF executed Gaza civilians,,worldnews
1710788812.0,Not a single Ukrainian soldier saw Red Cross representatives while in Russian captivity,,worldnews
1690033626.0,"Climate records tumble, leaving Earth in uncharted territory - scientists",,worldnews
1692634381.0,Calls for ‘ecocide’ law to punish those who destroy nature like war criminals,,worldnews
1700895793.0,"BBC: 650,000 conscription-aged men have left Ukraine for Europe",,worldnews
1704557360.0,Ukraine shows evidence Russia fired North Korea missile at Kharkiv,,worldnews
1711143585.0,ISIS claims responsibility for attack in busy Moscow-area concert venue that left at least 40 dead,,worldnews
1702384633.0,Alleged helicopter defector arrested for plotting to take a U.S. chinhock helicopter to China after they offered him $15M,,worldnews
1684398655.0,Pentagon reiterates that it does not object to other countries providing F-16s to Ukraine,,worldnews
1684766808.0,Mexico unveils new non-binary passport: ‘Diversity enriches and flourishes’,,worldnews
1701517084.0,Police raid Moscow gay bars after a Supreme Court ruling labeled LGBTQ+ movement 'extremist',,worldnews
1687767900.0,Russia's Prigozhin remains under investigation for mutiny,,worldnews
1710519003.0,"Palestinian gunmen, not Israeli forces, behind Gaza aid convoy deaths, IDF finds",,worldnews
1683985763.0,Jameson ceases whiskey exports to Russia after growing criticism,,worldnews
1680783173.0,Israel's North under attack by barrage of rockets from Lebanon,,worldnews
1689322738.0,Russia bans gender reassignment,,worldnews
1708610272.0,Moldovan breakway Republic Transnistria going to request annexation to Russia,,worldnews
1691538706.0,Thermal imaging reveals hidden gas seeping from 32 Aussie sites,,worldnews
1695810338.0,One of Putin's guards who denounced the war and fled Russia says he's being pursued even in South America,,worldnews
1682073875.0,"Vatican says disclosing emails in court clash is a ""grave sin""",,worldnews
1681124957.0,Belarus leader says he wants guarantees that Russia will defend his country if it is attacked,,worldnews
1698655052.0,Israeli-German Shani Louk's body found,,worldnews
1696757099.0,Two Israeli tourists killed after police officer fired at Israeli tourist group in Egypt,,worldnews
1702807594.0,Putin threatens Finland with ''problems'',,worldnews
1691947760.0,Toronto gay couple wins lawsuit in Italy after son's birth photo used without consent,,worldnews
1687813697.0,Putin confirmed the death of Russian pilots during the rebellion,,worldnews
1690716757.0,"Joining China's Belt and Road was an 'atrocious' decision, Italian minister says",,worldnews
1704849516.0,"US Navy shoots down 24 Houthi missiles and drones launched from Yemen over Red Sea, US defense officials say | CNN Politics",,worldnews
1682504516.0,"Following the invasion of Ukraine, majority of the world disapproves of Russia's leadership for the first time: new poll",,worldnews
1704645189.0,Israel’s talk of expanding war to Lebanon alarms U.S.,,worldnews
1708194200.0,"Czech Republic has identified a way to procure 3.5 million rounds of ammunition for Ukraine but needs funding to do so, said the country’s president Petr Pavel",,worldnews
1685952258.0,Contract proving Iran's sale of ammunition to Russia leaked to media,,worldnews
1710589355.0,"German intelligence warns of Russian attack on NATO from 2026, media says",,worldnews
1689530075.0,Environmental protesters vandalize superyacht of Walmart heir Nancy Walton Laurie,,worldnews
1706572837.0,"Biden’s response to Jordan attack is likely to be powerful, but US is wary of triggering a wider war with Iran, officials say | CNN Politics",,worldnews
1703863104.0,Poland says Russian missile entered airspace then went into Ukraine,,worldnews
1702651049.0,Newest NATO member Finland signs defence pact with US,,worldnews
1684546210.0,"The nine hours in which Spain made the 100% renewable dream a reality: Electricity generation through solar, wind and water exceeded total demand in mainland Spain on Tuesday, a pattern that will be repeated more and more in the future",,worldnews
1706732743.0,"Iran not seeking war with US but ‘not afraid of it’, says military chief",,worldnews
1708392568.0,"Alexey Navalny's widow says Russia ""hiding his body, refusing to give it to his mother""",,worldnews
1700836650.0,Red Cross in Gaza says Israeli hostages delivered to them,,worldnews
1695101233.0,"In a tit-for-tat, India expels Canadian diplomat",,worldnews
1699560576.0,US State Department says it hasn’t so far found evidence for Israeli war crimes in Gaza,,worldnews
1692912087.0,Flight Attendant on Prigozhin’s Jet Reported ‘Strange’ Repairs,,worldnews
1681938242.0,"Mexico's president slams U.S. ""spying"" after 28 Sinaloa cartel members charged, including sons of ""El Chapo""",,worldnews
1707513451.0,"Canadians won't be fooled by Putin propaganda on Ukraine, Trudeau says",,worldnews
1684341408.0,"Iranians are putting their livers, corneas, and testicles up for sale on Telegram to pay off debts amid rocketing inflation and poverty",,worldnews
1709539763.0,NATO begins large-scale exercises near borders of Russia,,worldnews
1710617779.0,"Russian missiles kill 20 in Odesa, Zelenskiy vows retaliation",,worldnews
1684067858.0,No talk of peace without withdrawal of Russian troops – Scholz,,worldnews
1693425988.0,"Police receive over 93,000 reports of sexual violence committed by Russians",,worldnews
1701226531.0,"Employees can be banned from wearing headscarves, top EU court rules",,worldnews
1697613893.0,IDF tells world: This is how Islamic Jihad destroyed the Gaza hospital,,worldnews
1697067332.0,"Nearly 40,000 Koreans die by suicide over past 3 years: data",,worldnews
1693672162.0,The Biden administration wants to know if Saudi Arabia used American weapons to kill 'hundreds' of migrants,,worldnews
1684838449.0,China braces for new Covid wave with up to 65 million weekly cases,,worldnews
1703815735.0,Captured Islamic Jihad terrorist admits his squad committed rape on Oct. 7,,worldnews
1711007688.0,Kyiv hit by Russian cruise missiles in series of 'massive strikes',,worldnews
1686818476.0,Estonia set to become first ex-Soviet state to back gay marriage,,worldnews
1684325411.0,Russia says hypersonic missile scientists face 'very serious' treason accusations,,worldnews
1695511662.0,Earth’s average 2023 temperature is now likely to reach 1.5 °C of warming,,worldnews
1704017270.0,US Military Says Sank Three Huthi Vessels That Attacked Container Ship In Red Sea and opened fire on the US helicopters,,worldnews
1685132881.0,Ukraine says Russia plans to simulate accident at nuclear power plant,,worldnews
1694250992.0,Emmanuel Macron ‘booed by entire stadium’ as he opens Rugby World Cup. The French president was barely audible as he took to the podium,,worldnews
1705872126.0,"Russia Deploys Silok Jammers To Ground Ukraine’s Drones. Ukraine Hunts Down The Siloks With, You Guessed It, Drones.",,worldnews
1709914844.0,"Russian missile hits 300-400 meters away from Zelensky and Greek PM, president says",,worldnews
1707144073.0,"'Zelenskyy: As far as ground war is concerned, it's hit a stalemate, that's a fact' ""We are fighting against terrorists who have one of the largest armies in the world. Ammunition is not enough – we need modern equipment."" [interview Italian TV channel Rai1]",,worldnews
1696529731.0,Putin says plane of Wagner boss Prigozhin was blown up using hand grenades on board,,worldnews
1691768799.0,Zelensky to Sack All ‘Military Commissars’ Because of ‘Cynicism and Graft’,,worldnews
1682227112.0,Ukrainian forces land on left bank of Kherson Oblast,,worldnews
1702676484.0,United States To Gain Access To 15 Military Bases In Finland,,worldnews
1711948730.0,Belarus threatens to attack Lithuania and Poland,,worldnews
1682048763.0,Russia’s National Guard commander who ordered poisoning Ukrainians in gas chambers identified,,worldnews
1707875158.0,Exhausted Ukraine struggles to find new men for front line,,worldnews
1711914825.0,Putin signs decree on spring military conscription,,worldnews
1704208671.0,"2,000 petrol pumps run dry in western and northern India as truck drivers strike against new hit-and-run law",,worldnews
1695869046.0,North Korea changes constitution and declares itself a nuclear state,,worldnews
1699044530.0,US asks Israel for ‘explanation’ of strike on Gaza refugee camp,,worldnews
1686320294.0,U.S. Official Says Spy Satellites Detected Explosion Just Before Dam Collapse,,worldnews
1703170102.0,Shooting at Prague university leaves dead and injured,,worldnews
1701706770.0,NATO chief on Ukraine war: ‘Be prepared for bad news’,,worldnews
1706327386.0,"Kim Jong-un admits “terrible situation” in rural areas, pushes for regional development",,worldnews
1683622459.0,Putin says a 'real war' is being waged against Russia in Victory Day speech,,worldnews
1697272513.0,Australians reject Indigenous recognition via Voice to Parliament,,worldnews
1711144011.0,Russia says United States must share any information it has on attack near Moscow,,worldnews
1681002952.0,"Georgia's former president says he's dying in prison because of Putin, and calls on the US to save his life",,worldnews
1686972493.0,Six hypersonic missiles downed over Kyiv in fresh blow to Putin,,worldnews
1709468390.0,Hamas refuses to provide info on wellbeing of hostages as Cairo talks commence,,worldnews
1691662165.0,Cheng Lei: Journalist held in China says she sees only 10 hours of sun a year,,worldnews
1701966496.0,Russia warns US that Ukraine will be its ‘second Vietnam’,,worldnews
1696955216.0,Russia is defeated in its bid to regain a seat on the UN's top human rights body,,worldnews
1691401196.0,Kremlin Says 'Theoretically Possible' to Not Hold Presidential Elections,,worldnews
1685631442.0,"Seven of the nine thresholds that allow for human life on earth have already been crossed: A new report quantifies the climatic, natural and pollutant limits that ensure the safe and orderly maintenance of civilization",,worldnews
1684250080.0,"3 Russian Hypersonic Missile Scientists Jailed for Treason, Colleagues Say",,worldnews
1686044036.0,"World leaders condemn Russia's destruction of Kakhovka dam, call it war crime",,worldnews
1685005798.0,Le Pen questioned for four hours about Russia ties by Parliament inquiry,,worldnews
1698863045.0,IDF releases proof of Hamas stealing gas from Gazan hospitals,,worldnews
1698165408.0,IDF says Gaza photos show half million liters of fuel held by Hamas,,worldnews
1705921656.0,"Media: After Ukrainian drone attack on Novatek, Moscow shifts air defenses from frontline to rear areas",,worldnews
1682379968.0,H5N1 with 100% fatality rate observed in group of wild seals in the United States,,worldnews
1696694117.0,An Israeli airstrike has flattened a high-rise building in central Gaza City after Hamas launched a surprise attack,,worldnews
1704996169.0,US Demands Iran Release Seized Oil Tanker 'Immediately',,worldnews
1685727418.0,Belarus’ Lukashenko: ‘The only mistake we made’ was not finishing off Ukraine with Russia in 2014,,worldnews
1703937383.0,Ukraine and 30 countries request emergency UN security council meeting following Russian assault,,worldnews
1695803655.0,Dead’ Russian Admiral Shoved in Front of the Cameras to Prove He Survived Missile Blast.,,worldnews
1682793827.0,Canadian warship intercepts boat carrying $50M worth of cocaine off Mexico,,worldnews
1690770187.0,Pro-coup protesters in Niger shout 'long live Putin' as new leaders face calls to cede power,,worldnews
1682930725.0,Ukrainian defenders oust Russian forces from some positions in Bakhmut,,worldnews
1687371103.0,‘No future’: Iceland cancels whale hunt over animal welfare concerns: decision follows government report that found many whales suffer immensely after being harpooned,,worldnews
1689014151.0,Commander involved in strikes on Ukraine shot dead in Russia,,worldnews
1684459045.0,"Moldova, fearing Russia, wants to join EU 'as soon as possible'",,worldnews
1694533801.0,Egypt bans niqab in schools,,worldnews
1689604342.0,Belarus abducts thousands of Ukrainian children,,worldnews
1689867382.0,Occupied Ukrainian Nuclear Power Plant staff refusing Russian orders to start up reactor,,worldnews
1686418639.0,Russian plane grounded at Toronto Pearson for more than a year seized by Canadian government,,worldnews
1683139146.0,"New Alzheimer’s drug slows cognitive decline by 35%, trial results show",,worldnews
1688884926.0,UK’s soaring liver cancer death rate blamed on alcohol and obesity,,worldnews
1693190865.0,France to ban female students from wearing abayas in state schools,,worldnews
1710089269.0,"U.S. military flies Marines into Haiti embassy, evacuating some staff in overnight airlift",,worldnews
1709687730.0,US now pushes UN to back 'immediate' Gaza ceasefire to free hostages,,worldnews
1688056305.0,Drugs rain down on French countryside after fighter jet intercepts drug-trafficking plane,,worldnews
1698626967.0,"Hamas sees all its hostages as Israelis, official tells Russian state media",,worldnews
1708045882.0,"Long COVID Seems to Be a Brain Injury, Scientists Discover",,worldnews
