created_utc,title,self_text,subreddit
1690482328.0,"‘Era of global boiling has arrived,’ says UN chief as July set to be hottest month on record",,worldnews
1698020840.0,"Hamas Leaders Ordered Slaughter of Women and Children, Captured Terrorist Says Under Interrogation: Report",,worldnews
1691164220.0,Latvia to ask thousands of Russian citizens to leave the country,,worldnews
1696184755.0,"Biden vows to stand by Ukraine, despite budget fiasco",,worldnews
1702573720.0,‘Real Risk’ Putin Won’t Stop with Ukraine: NATO Chief,,worldnews
1686634395.0,25% people in 80 countries think husband beating wife justifiable: Shocking UN report,,worldnews
1698405472.0,Russian Navy mine hunter reportedly explodes in bay at Russian-occupied Sevastopol,,worldnews
1707936050.0,"US Navy aircraft carrier going head-to-head with the Houthis has its planes in the air 'constantly,' strike-group commander says",,worldnews
1681169621.0,"Egypt secretly planned to supply rockets to Russia, leaked U.S. document says",,worldnews
1711639356.0,"Ukraine's Zelenskyy warns Putin will push Russia's war ""very quickly"" onto NATO soil if he's not stopped",,worldnews
1708204795.0,Zelenskyy offers Trump a tour of Ukraine’s front line,,worldnews
1696947945.0,US warns Hezbollah not to open new front against Israel,,worldnews
1689084403.0,UN praises 'remarkable' India as 415 million exit poverty levels in 15 years,,worldnews
1711962468.0,Turkey's Erdogan concedes defeat in local elections nationwide,,worldnews
1681036570.0,NATO announces date of largest air force exercise in history,,worldnews
1682607981.0,U.S.: Russian Subs in Atlantic ‘More Active Than We’ve Seen Them in Years’,,worldnews
1696856536.0,Walmart and Costco Agree to 'Aggressive' Price Cuts on Food After Canada Turns Up the Heat,,worldnews
1693274534.0,Saudi Arabia reportedly sentences man to death for criticizing government on social media,,worldnews
1710287745.0,US to send new weapons package worth $300 million for Ukraine,,worldnews
1708875984.0,"Vast majority of Iranians want a secular government, poll reveals",,worldnews
1695561136.0,"US in talks for largest-ever sale of arms, fighter jets to Vietnam",,worldnews
1711277392.0,Ukraine confirms striking 2 large Russian landing ships in occupied Crimea,,worldnews
1701814032.0,"Ukraine could lose the war if the U.S. delays military aid, top Ukrainian official says",,worldnews
1690635417.0,"More Wagner fighters move closer to Polish border, Poland PM says",,worldnews
1692955062.0,U.S. ambassador to Japan will publicly eat Fukushima fish amid radioactive water release outrage,,worldnews
1690620896.0,"Antarctica hits -83.2C, earth's lowest temperature since 2017",,worldnews
1697328645.0,"Israel's invasion of Gaza was planned for this weekend but has been delayed by ""a few days,"" in part because of cloudy conditions, according to the New York Times",,worldnews
1700672953.0,Biden Admin warns it might not support next phase of Israel's war,,worldnews
1711934298.0,5-year Havana Syndrome investigation finds new evidence linked to Russian intelligence and acoustic weapons,,worldnews
1711201703.0,Islamic State releases photo of alleged attackers in Russia shooting,,worldnews
1705412705.0,Reports of a missile hitting European-owned commercial ship off Yemen's coast - I24NEWS,,worldnews
1688049858.0,Zelensky: Legalizing medical cannabis can help Ukrainians' war trauma,,worldnews
1685675430.0,Russia's own economic figures show a steep drop in industrial output amid a record labor shortage,,worldnews
1690517979.0,Putin thanks North Korea for supporting Russia’s invasion of Ukraine,,worldnews
1687793575.0,"Wagner leader Prigozhin breaks his silence, issuing first audio statement since mutiny",,worldnews
1687797109.0,"Germany offers to station 4,000 troops in Lithuania to strengthen NATO's eastern flank",,worldnews
1701731019.0,Israel reveals disturbing testimonies of Hamas rape on October 7 at UN,,worldnews
1681858127.0,Mexican president accuses Pentagon of spying; vows to restrict military information,,worldnews
1711100230.0,US has urged Ukraine to halt strikes on Russian energy infrastructure.,,worldnews
1680800821.0,49 countries condemn Russia's attempts to justify deportation of Ukrainian children,,worldnews
1681501349.0,Norway will not send fencers to events where Russia and Belarus participate,,worldnews
1701654145.0,Leaks shows Qatar secretly sent $15 million to Islamist movements in northern Mali,,worldnews
1689418826.0,"Russia closes Polish consulate due to “unfriendly” acts, Poland pledges “equivalent response”",,worldnews
1710706025.0,Report: US border patrol nabbed Hezbollah man headed to New York 'hoping to make a bomb',,worldnews
1695351670.0,Attack on Crimean Airfield Left ‘30 Dead Russians and Multiple Aircraft Damaged’,,worldnews
1703341940.0,Blinken calls out other countries for not demanding Hamas surrender and ‘stop hiding behind civilians’,,worldnews
1687617974.0,Iran says events in Russia are Russia's internal affairs,,worldnews
1710192523.0,"Zelensky: As long as Ukraine holds, French army can stay in France",,worldnews
1708435243.0,Putin Promotes Top Prison Official Accused of Tormenting Navalny Behind Bars,,worldnews
1696430963.0,US will transfer weapons seized from Iran to Ukraine,,worldnews
1690655095.0,Putin says Russia withdrew army from Kyiv because it was “asked”,,worldnews
1683473046.0,Russia may be preparing provocations against its civilian population on 9 May – Ukrainian Intelligence,,worldnews
1697867160.0,"Associated Press visual analysis confirms: Rocket from Gaza appeared to go astray, likely caused deadly hospital explosion",,worldnews
1711468404.0,"Russian intel chief says U.S., UK and Ukraine were behind Moscow shooting - I24NEWS",,worldnews
1699548292.0,Police say 2 Jewish schools in Montreal hit by bullets overnight,,worldnews
1685874487.0,"NATO does not challenge Russia's security, but Russian imperialism – Estonian Prime Minister",,worldnews
1696874880.0,Egypt warns against pushing civilian Palestinians towards Egyptian borders,,worldnews
1709390740.0,US military aircraft airdrop thousands of meals into Gaza in emergency humanitarian aid operation,,worldnews
1701870414.0,Venezuela-Guyana dispute: Maduro mobilizes the army and announces annexation of Essequibo,,worldnews
1680967943.0,Ukraine gets back 31 children from Russia after alleged deportation,,worldnews
1698747729.0,"Israel expands Gaza offensive, sends troops into Hamas tunnels",,worldnews
1705068202.0,Large protests break out in Yemen after U.S.-British attacks,,worldnews
