created_utc,title,self_text,subreddit
1691417040.0,Nazi symbols and child pornography found in German police chats,,worldnews
1696651441.0,Palestinian militants launch dozens of rockets into Israel. Sirens are heard across the country,,worldnews
1709604424.0,China drops 'peaceful reunification' reference to Taiwan; raises defence spending by 7.2%,,worldnews
1703563906.0,Zelenskyy after 5 warplanes were downed in one week: Every Russian pilot has to make a choice,,worldnews
1690082875.0,"Israel: Another 10,000 IDF reservists announce they won't serve anymore; They join more than 1,000 Air Force reservists who made the same announcement in a letter on Friday",,worldnews
1711157822.0,"Russia says 60 dead, 145 injured in concert hall raid; Islamic State group claims responsibility",,worldnews
1711730750.0,Ukrainian Navy confirms Russia downed its own Su-27 aircraft over Crimea,,worldnews
1705494571.0,"'Nazis, no thank you'; Germans take to streets to call for far-right party AfD ban",,worldnews
1697974752.0,Israel tells Gazans to move south or risk being seen as 'terrorist' partner,,worldnews
1691609439.0,"Russians ask people not to burn down military enlistment offices, blaming “Ukrainian scammers” for it",,worldnews
1697126733.0,France bans pro-Palestinian protests: interior minister,,worldnews
1698779596.0,Israel strikes Gaza’s Jabalya refugee camp,,worldnews
1698515840.0,Detained terrorists admit Hamas using hospitals to shield themselves,,worldnews
1681991068.0,Quebec education minister issues directive banning religious practices in public schools,,worldnews
1683494154.0,Türkiye refuses to send Russian S-400s to Ukraine as proposed by US,,worldnews
1702985907.0,"Putin waits for Trump to negotiate Ukraine without EU, Czech President Petr Pavel has said.",,worldnews
1695691084.0,Russian troops sexually assaulted Ukrainian women as old as 83 while their families were forced to listen,,worldnews
1682441916.0,Bank of England economist says people need to accept they are poorer,,worldnews
1703338041.0,Russia stole nearly 8 million tons of harvest in occupied Ukraine,,worldnews
1711471701.0,Israeli Hostage Says She Was Sexually Assaulted and Tortured in Gaza,,worldnews
1681714831.0,Slovakia hands over all 13 promised MiG fighter jets to Ukraine,,worldnews
1681200110.0,"Moderna seeking to roll out vaccines for cancer, heart disease by end of decade",,worldnews
1683319556.0,"Moldovan President: We’re only safe thanks to Ukraine, Russia wants to remake the Soviet Union",,worldnews
1703724296.0,"Russia is drastically underplaying the death toll of its warship exploding, report suggests",,worldnews
1693270824.0,Russian Embassy Releases Map Recognizing Crimea as Ukraine's,,worldnews
1698343594.0,"At UN, Iran warns US will 'not be spared' if war in Gaza continues",,worldnews
1709243634.0,France's president Macron stands by statement about sending troops to Ukraine,,worldnews
1699022506.0,US warns Israel amid Gaza carnage it doesn’t have long before support erodes | CNN,,worldnews
1700436099.0,Far-right libertarian economist Javier Milei wins Argentina presidential election,,worldnews
1711458643.0,Polish official says NATO considering shooting down Russian missiles that approach its borders,,worldnews
1708717361.0,"‘China destroyed 21,000 acres of West Philippine Sea coral reefs’",,worldnews
1683116350.0,Kremlin accuses Ukraine of trying to assassinate Putin,,worldnews
1696675174.0,"‘We are at war,’ Netanyahu says, after Hamas launches devastating surprise attack",,worldnews
1685713172.0,Blinken says no Ukraine cease-fire without a peace deal that includes Russia's withdrawal,,worldnews
1711608104.0,"Putin says Russia will not attack NATO, but F-16s will be shot down in Ukraine",,worldnews
1697662322.0,Sunak on Gaza hospital blast reporting: Hamas should be distrusted like the Kremlin,,worldnews
1696902805.0,Anti-Israel Protestors Shout 'Gas the Jews' Outside Sydney Opera House,,worldnews
1702032648.0,"UK Foreign Secretary to US: Blocking Ukraine aid would be ""Christmas present"" to Putin",,worldnews
1701858740.0,"At least 10 freed hostages were sexually abused by Hamas in captivity, doctor says",,worldnews
1701963744.0,Japan to provide $ 4.5 billion to Ukraine,,worldnews
1687603950.0,Zelenskyy on rebellion against Putin: Russia’s weakness obvious,,worldnews
1692040372.0,"Earth just had its hottest July 'by a long shot,' NASA and NOAA say",,worldnews
1690225809.0,"68% of Israeli startups taking legal and financial steps due to judicial overhaul - like withdrawing cash reserves, changing HQ location outside Israel, relocation of employees and conducting layoffs",,worldnews
1689099510.0,"Twitter better for ‘freedom of speech’, says senior Afghan Taliban official",,worldnews
1687618902.0,"Putin calls Kazakh president to brief him on Wagner uprising but Tokayev says it is ""internal matter of Russia""",,worldnews
1693133306.0,Prigozhin confirmed dead after genetic testing - Moscow,,worldnews
1710325628.0,Russia Celebrates as Hungary's Orban Says Trump Will Force Ukraine to Surrender to Putin,,worldnews
1693857023.0,Russia arrests mathematician on terrorism charges minutes after his release from prison,,worldnews
1698415161.0,Hamas headquarters located under Gaza hospital,,worldnews
1688084281.0,Mystery In Moscow As Russian Bank Vice-President ‘Falls Out Of A Window’,,worldnews
1700109617.0,"Earth is 'big enough' for U.S. and China to succeed, Xi says as he meets Biden",,worldnews
1694209866.0,Police discover 80 Russian torture chambers in Ukraine,,worldnews
1693584643.0,Retired teacher sentenced to death in Saudi Arabia after tweeting criticism,,worldnews
1687963275.0,No presidential election in Ukraine till war ends: Zelensky,,worldnews
1695751406.0,House Speaker Anthony Rota resigns over Nazi veteran invite,,worldnews
1699496418.0,"Transgender people can be baptized Catholic, serve as godparents, Vatican says",,worldnews
1692451252.0,"Russians hit Chernihiv Music and Drama Theatre with missile, killing 7 civilians, including child, wounding 90",,worldnews
1708541072.0,U.S. Attorney Announces Nuclear Materials Trafficking Charges Against Japanese Yakuza Leader,,worldnews
1693842830.0,Japan may seek to dissolve Moonies church in wake of Shinzo Abe killing,,worldnews
1686110817.0,"China's exports plunge by 7.5% in May, far more than expected",,worldnews
1690805239.0,"Russians forcibly mobilise about 60,000 men from occupied territories",,worldnews
1710690126.0,Moscow flights grounded by mass Ukrainian drone strikes,,worldnews
1706390429.0,Ukraine: Hack wiped 2 petabytes of data from Russian research center,,worldnews
1689133917.0,North Korea fires intercontinental ballistic missile after threatening US,,worldnews
1697024729.0,"Gaza's only power station will shut down within hours, says ICRC",,worldnews
1709061099.0,"North Korea sent more than 3m artillery shells to Russia, says Seoul",,worldnews
1706285540.0,"Yemen Houthi rebels fire a missile at a US warship, escalating worst Mideast sea conflict in decades",,worldnews
1697178861.0,Hamas Calls On Palestinians To Stay In Their Homes After Israel Orders Mass Evacuation In Gaza,,worldnews
1704467637.0,ISIS spokesman calls for global attacks on Jews: 'Kill them wherever you find them',,worldnews
1698492165.0,"New York Times: Hamas' stockpiles of fuel, food, water and medicine enough to keep fighting for months",,worldnews
1698799993.0,UN confirms that Russia attacked Hroza and all victims were civilians,,worldnews
1692153069.0,"Russian officers refused to collect the bodies of dead troops so the military wouldn't have to pay their families, convict soldier says",,worldnews
1680776893.0,Russia arrests LGBTQ+ YouTubers on ‘gay propaganda’ charges,,worldnews
1684078808.0,Polls close in Turkey's fiercely fought elections that could unseat Erdogan,,worldnews
1698429160.0,Near-Total Internet Blackout Hits Gaza As Israel Ramps Up Strikes,,worldnews
1691767277.0,Metro 2033 author Dmitry Glukhovsky sentenced to 8 years in prison for criticizing Russia's invasion of Ukraine,,worldnews
1682172703.0,China's ambassador to France says former Soviet countries have ‘no status in international law’,,worldnews
1694296711.0,US seizes nearly 1 million barrels of Iranian oil allegedly bound for China,,worldnews
1689513506.0,"Türkiye supports NATO expansion, including Ukraine's membership",,worldnews
1692553670.0,We are ready to exchange Belgorod for NATO membership – Zelenskyy,,worldnews
1686631043.0,"India threatened to shut down Twitter and raid employees' homes, Jack Dorsey says",,worldnews
1710213763.0,"Trump's plan to end the Ukraine war is to totally cut off funding, says Putin's closest EU ally",,worldnews
1681688587.0,Putin meets with China's defense minister in Moscow,,worldnews
1695915561.0,Muslim man lynched in India ‘for taking a banana’ at Hindu temple event,,worldnews
1706886616.0,Russia finds ‘errors’ in paperwork of candidate hoping to stand against Putin,,worldnews
1684345938.0,Archaeologists Digging Along a Train Route in Mexico Have Found an Extremely Rare Statue of a Maya Deity- The statue is one of only three known in the world,,worldnews
1682496071.0,Russia suffering worst labor shortage in 25 years,,worldnews
1701559143.0,Video Emerges Appearing to Show Russian Soldiers Executing Surrendering Ukrainians,,worldnews
1711552362.0,"Some NATO countries ‘don’t understand urgency of stopping Russia,’ says Swedish FM",,worldnews
1701287500.0,Pope strips anti-gay US cardinal of his Vatican apartment and salary,,worldnews
1683637169.0,The Last Female Yangtze Giant Softshell Turtle Is Dead,,worldnews
1698560677.0,Norway: 'Israel going too far' in Gaza,,worldnews
1697206527.0,"White House: Israel's call to move Gaza civilians is ""a tall order""",,worldnews
1689257495.0,IOC does not plan to invite Russia and Belarus to Olympics-2024,,worldnews
1694804102.0,"Kadyrov, head of Chechnya, in critical condition: Ukrainian Intelligence reports",,worldnews
1709638568.0,France's Macron urges Ukraine's allies not to be 'cowards',,worldnews
1687641338.0,Billions of roubles: Prigozhin claims Russian forces have found a van and 2 buses containing boxes of his money,,worldnews
1693822470.0,Russia is becoming increasingly dependent on Chinese banks as its yuan borrowings more than quadruple,,worldnews
1687634326.0,Ukrainian military: Forces have advanced on the eastern front,,worldnews
1709371089.0,"Thousands turn out to mourn Navalny,  defying Putin, at funeral in Moscow",,worldnews
1698784327.0,"Senior Hamas official: The tunnels are for us, the UN can take care of Palestinian citizens",,worldnews
1710911197.0,"Bloomberg reports that Ukraine's long-range drone attacks have managed to cut Russia's daily oil refining capacity by up to 900,000 barrels",,worldnews
1706908960.0,"US starts retaliatory strikes in Iraq, Syria -officials",,worldnews
1711525282.0,Kremlin calls Zelensky 'peculiar kind of Jew' over IS attack claim,,worldnews
1707337725.0,US drone strike kills Iran-aligned militia leader in Baghdad,,worldnews
1710961993.0,Israel fears 'domino effect' after Canada arms embargo,,worldnews
1690197716.0,Hundreds of thousands of people fled Russia after it invaded Ukraine — and now the countries that took them in are seeing a boost in their economies,,worldnews
1708692049.0,Zelenskyy: Trump cannot end Ukrainian war in 24 hours,,worldnews
1709985548.0,Erdogan says Turkey firmly backs Hamas leaders,,worldnews
1702837461.0,"Hamas operates all over Germany, investigation finds",,worldnews
1698211844.0,Israel's military tells UN in Gaza: ask Hamas for fuel,,worldnews
1691681144.0,"300,000-year-old skull found in China unlike any early human seen before",,worldnews
1710876349.0,"Russian, Belarusian athletes barred from opening ceremonies of Paris Olympics",,worldnews
1711986851.0,Israeli airstrike in Damascus kills top Iranian general,,worldnews
1690349933.0,Two-thirds of African leaders refuse to attend Putin’s summit,,worldnews
1688723505.0,"Russia is on the edge of civil war, Ukraine spy chief claims",,worldnews
1710158333.0,3 Palestinians arrested in Italy on terrorist plot suspicion,,worldnews
1710766961.0,"In a global first, Gambia could reverse its ban on female genital cutting",,worldnews
1709118965.0,"Hamas Rejects Cease-Fire Proposal, Dashing Biden’s Hopes of Near Term Deal",,worldnews
1683796599.0,Zelenskyy believes in Ukraine's victory before 2024 US elections,,worldnews
1684674418.0,Biden receives flat assurance that Ukraine will not use F-16 fighter jets on Russian territory,,worldnews
1680860291.0,"Turkish graphic designer detained over anti-Erdoğan stickers he designed, ""Is this product too expensive for you? This is thanks to Erdoğan. """,,worldnews
1705441749.0,"Putin claims that if it wouldn't have been for Ukraine, war would have ended long ago",,worldnews
1696016506.0,US calls on Serbia to withdraw its 'unprecedented' military deployment on Kosovo border,,worldnews
1689431367.0,Zelenskyy says quick end to war directly depends on global support,,worldnews
1710699198.0,"Russia election: Putin wins with 88% support, exit poll says",,worldnews
1683463167.0,"Vietnam has recorded its highest ever temperature, just over 44C (111F) - with experts predicting it would soon be surpassed because of climate change.",,worldnews
1687614147.0,"On border with Belarus, Ukrainian forces turn on loudspeakers to call on Belarusians to topple Lukashenko, condemn war",,worldnews
1702212080.0,IDF releases video of Hamas stealing aid from Gazans,,worldnews
1705572812.0,"Ukraine Confirms St Petersburg Attack, Claims Drone Flew Over Putin’s Valdai Residence",,worldnews
1681378700.0,"China’s ‘artificial sun’ breaks record, marking latest milestone in quest for efficient thermonuclear fusion reactors",,worldnews
1699641803.0,"‘Corpses on streets’: Sudan’s RSF kills 1,300 in Darfur, monitors say",,worldnews
1696357047.0,"India: Opposition Leader Mahua Moitra Dragged, Forcibly Lifted By Delhi Cops As She Shouts ‘How Can You Do This To An MP?'",,worldnews
1696484298.0,US and EU look for legal grounds to transfer $300 billion of Russian assets to Ukraine – Blinken,,worldnews
1690351209.0,"Japan’s population drops by nearly 800,000 with falls in every prefecture for the first time",,worldnews
1687460061.0,OceanGate Expeditions believes all 5 people on board the missing submersible are dead,,worldnews
1698292904.0,Biden says he has 'no confidence' in Palestinian death count,,worldnews
1691886371.0,Iran protests: Teen girl Sonia Sharifi 'abducted' and 'tortured' by Iranian forces for second time,,worldnews
1711254380.0,Ukraine war: Kyiv hit by multiple explosions in Russian bombardment,,worldnews
1697865605.0,Israel destroys underground tunnels in Gaza Strip and kills Hamas engineer who developed weapons,,worldnews
1702514752.0,"Israeli leaders: War to go on until Hamas defeated, ‘with or without’ world’s approval",,worldnews
1709554446.0,EU fines Apple €1.8bn over App Store restrictions on music streaming,,worldnews
1701443177.0,"Russian Troops Say They’re Starving, Sent to Slaughter – New Video",,worldnews
1693105541.0,Almost 100 Leopard 1s stored in the open in Italy as Switzerland blocked their transfer to Ukraine,,worldnews
1691524881.0,Ukrainian official: Russia is sponsor of global neo-Nazism and must be demilitarized,,worldnews
1683653645.0,"Polish mayor falls to death from hotel balcony in Sardinia, Italy",,worldnews
1683571303.0,Poland hands over 10 MiG-29 fighters to Ukraine,,worldnews
1682529722.0,US Ambassador: 'Hungary's policy of standing alone to block high level meetings of NATO-Ukraine Committee untenable',,worldnews
1711417491.0,Putin acknowledges ‘radical Islamists’ carried out Moscow terror attack,,worldnews
1699996585.0,"The U.S. says Hamas operates within and beneath hospitals, endorsing Israel’s allegations",,worldnews
1708118802.0,Putin signs property confiscation law - The law is aimed to punish for spreading “falsehoods” about the Russian army,,worldnews
1698054155.0,Fury as Islamists chant Hamas slogans on the streets of London during huge pro-Palestine protest the same day the Met allowed a 'jihad' chant - as Robert Jenrick says police chiefs will be summoned to explain their actions,,worldnews
1705698178.0,"Zelenskyy invites Trump to Ukraine again, calls his ''peace plan'' dangerous",,worldnews
1702436468.0,Lesbian couple flees Italy as government strips them of parental rights,,worldnews
1707949589.0,ABC News: Alleged 'serious threat' to US national security relates to Russia's plans to put nuclear weapons in space,,worldnews
1682154114.0,Greenland's melt goes into hyper-drive with unprecedented ice loss in modern times,,worldnews
1690483731.0,Sweden approves Torah burning in Stockholm outside Israeli embassy,,worldnews
1693349059.0,Ukraine war: 'Drone attack'; hits airport in northwest Russia city of Pskov - BBC News,,worldnews
1687121596.0,"Almost 60% of Swiss voters have backed plans to severely cut emissions by 2050 despite opposition from the right-wing Swiss People's Party. In a second vote, 78.5% supported a minimum tax of 15% for multinational firms",,worldnews
1684698788.0,"Russian Deputy Education Minister, 46, Dies On Return Flight From Cuba",,worldnews
1706037541.0,"We are running out of time to build defences against Russia, warns Norway's commander in chief",,worldnews
1688925338.0,"Trump's claim that he could end Ukraine's war in a day is a 'beautiful' thought but not true, Zelenskyy says",,worldnews
1684843175.0,Kremlin deeply concerned about situation in Belgorod Oblast,,worldnews
1681845076.0,A verbal slip by Russia's Vladimir Putin on a rare visit to occupied Ukraine suggested the trip happened days earlier and was kept secret,,worldnews
1695584143.0,"A Russian reserve army of 15,000 soldiers is pinned down near Bakhmut and will be destroyed, says Ukraine's spy chief",,worldnews
1695208097.0,Russia's State Duma says it would eventually fight all post-Soviet states,,worldnews
1683288062.0,UK Conservatives suffer ‘terrible’ night of local election losses,,worldnews
1698143547.0,"All three Italians missing after Hamas attack are dead, Rome says",,worldnews
1711377591.0,"Netanyahu says if US fails to veto UN call for cease-fire, Israeli officials will not travel to D.C.",,worldnews
1695429964.0,Turkish president says he's bothered by U.N. decor that resembles 'LGBT colors',,worldnews
1700935911.0,"Ukraine now in full control of Kherson Oblast’s left bank, forcing Russians to flee from reinforced ‘Surovikin'",,worldnews
1700420075.0,Surveillance footage shows Hamas bringing hostages into Shifa Hospital on Oct. 7,,worldnews
1704043992.0,Queen of Denmark announces abdication live on TV,,worldnews
1702069141.0,US vetoes UN resolution calling for Gaza ceasefire,,worldnews
1683743474.0,A mysterious object has been found that is 10 million times brighter than the sun. Scientists can't work out why it hasn't exploded,,worldnews
1683314190.0,Father of the school shooter in Serbia has been arrested and is on trial for allowing his son access to guns and ammunition,,worldnews
1696398055.0,16-Year-Old Girl In Coma After Alleged Assault Over Hijab Rules In Iran Metro,,worldnews
1710674087.0,Moscow Fears Armenia Now Following Same Path as Georgia and Ukraine,,worldnews
1699277313.0,Queen Rania of Jordan says being pro-Palestinian does not equal being ‘antisemitic’,,worldnews
1682322575.0,Chinese embassy removes interview transcript on ex-Soviet states,,worldnews
1685401709.0,Groundbreaking Israeli cancer treatment has 90% success rate,,worldnews
1701176314.0,"Aunt says Hamas forced 12-year-old hostage to watch videos of atrocities, aimed gun at him when he cried",,worldnews
1707734944.0,Dutch court orders halt to export of F-35 jet parts to Israel,,worldnews
1680833103.0,"Armenia will participate in NATO maneuvers, abandoning CSTO exercises",,worldnews
1681393324.0,Security details of Joe Biden's plans in Ireland found on a Belfast street,,worldnews
1696767232.0,Israel's Security Cabinet Approves Declaration of War.,,worldnews
1690106022.0,Lukashenko threatens Poland with Wagnerites: They want to go to West,,worldnews
1710607029.0,Man detained in Moscow for writing ‘Putin is a murderer’ on his ballot,,worldnews
1697640614.0,Saudi Arabia calls on citizens to immediately leave Lebanon,,worldnews
1690993321.0,PM Justin Trudeau and wife Sophie Gregoire Trudeau are separating,,worldnews
1704509034.0,"Russia Got 7,500-Pound Rockets From North Korea - And promptly Blew Up A Pair Of Ukraine Supply Bases",,worldnews
1707823046.0,Estonia Says Russia Is Preparing For A Military Confrontation With The West,,worldnews
1701269819.0,Hamas announces death of youngest hostage Kfir Bibas,,worldnews
1710248120.0,"Anti-Kremlin Russian Volunteers Infiltrate Inside Russia With Tanks, Capture One Village",,worldnews
1681534494.0,Putin approves e-conscription notices and closes borders for evaders,,worldnews
1709095143.0,‘Kremlin Leaks’: Files detail Putin’s €1 billion propaganda effort ahead of presidential vote,,worldnews
1699759724.0,Russia says a battalion made up of Ukrainian prisoners of war is about to be sent to fight against their own country,,worldnews
1690914527.0,Polish Ministry of Defense confirmed cross of the border by two Belarusian helicopters,,worldnews
1691099313.0,U.S. moves to put Marines on commercial ships to stop Iranian seizures,,worldnews
1688575223.0,Macron's call to 'cut off' social media during riots sparks backlash in France,,worldnews
1697016547.0,Zelenskyy says he’ll run for second presidential term if war continues,,worldnews
1683888991.0,Zelensky holds Staff of Supreme Commander-in-Chief meeting: Grond Forces commander reports halt of Russian advance on multiple fronts,,worldnews
1681332334.0,"Zelenskyy tells global finance leaders in Washington that his country needs $14.1 billion immediately for critical reconstruction projects, pleading with officials to use frozen Russian assets to help pay the cost",,worldnews
1698064395.0,80% of Israelis say Netanyahu must take public responsibility for Oct. 7 failures,,worldnews
1684100173.0,Russian State Duma confirms information on Lukashenko’s illness,,worldnews
1699464735.0,Russian missile hits civilian vessel under Liberian flag off Odesa coast,,worldnews
1695266789.0,Saudi crown prince on Iran acquiring nuclear weapons- 'If they get one we have to get one',,worldnews
1703075502.0,Xi warned Biden during summit that Beijing will reunify Taiwan with China,,worldnews
1681342040.0,North Korean missile launch triggers evacuation order in Japan | NK News,,worldnews
1703690527.0,Russia warns Japan over providing Patriot air defence systems to Ukraine,,worldnews
1707424812.0,Massive Explosion Hits Russian Plant Making Nuclear Capable ICBMs,,worldnews
1709072478.0,"VSquare: Kremlin leaks, secret files reveal how Putin pre-rigged his reelection",,worldnews
1706496484.0,"China Evergrande ordered to liquidate, owing $300 bln",,worldnews
1698175227.0,"Israel slams UN chief for saying Hamas attack ‘did not happen in a vacuum,’ calls for his resignation",,worldnews
1700479939.0,40 workers have been trapped inside a collapsed tunnel in India for over a week and 3 attempts to drill through the debris have failed so far,,worldnews
1694642666.0,US approves $5 bn sale of F-35 jets to South Korea,,worldnews
1702126446.0,Russia Warns Israel Over Flooding Tunnels in Gaza: 'War Crime',,worldnews
1698448767.0,Israeli Military Launches Major Ground Incursion In Gaza,,worldnews
1692122963.0,Talk of Ukraine joining NATO in exchange for territorial concessions is unacceptable – Ukraine's Foreign Ministry,,worldnews
1707235406.0,"One fifth of hostages in captivity are actually dead, NYT reports",,worldnews
1708434277.0,Alexei Navalny's wife Yulia Navalnaya has X social media account suspended,,worldnews
1700143604.0,Biden: Gaza op will end when Hamas can no longer murder Israelis,,worldnews
1682648806.0,Putin signs into law decision to deport Ukrainians without Russian passports from Russian-occupied Ukrainian territories,,worldnews
1683193898.0,Russia accuses U.S. of being behind alleged Kremlin drone attack,,worldnews
1685810563.0,"Le Pen’s far right served as mouthpiece for the Kremlin, says French parliamentary report",,worldnews
1702431420.0,Biden Administration Announces New Security Assistance for Ukraine,,worldnews
1691994954.0,Ruble Crashes Through 100 Per Dollar Despite Central Bank’s Move,,worldnews
1704113050.0,First surface vessel attack on Crimea failed as Musk turned off connection – UP,,worldnews
1704912983.0,Ukraine's Zelensky says Vladimir Putin won't stop war 'until we all finish him',,worldnews
1703833367.0,"Russia launches massive attack: explosions ring out in Kyiv, Lviv and other cities",,worldnews
1699170769.0,Blinken says ‘shocking’ that brutality of Hamas massacres has receded in memories of many,,worldnews
1694726237.0,Wagner Group sustains significant losses in clashes with Central African Republic rebels,,worldnews
1684083454.0,"Cuba's LGBTQ community celebrates same-sex marriage with pride conga: Chanting ""socialism yes, homophobia no""",,worldnews
1683815868.0,Serbians hand over thousands of weapons after mass shootings,,worldnews
1711084256.0,"Dermer: Israel will enter Rafah 'even if entire world turns on us, including the US'",,worldnews
1683532999.0,South Korea's biggest Pride event was blocked in favour of a Christian youth concert,,worldnews
1701453475.0,"‘Everything indicates’ Chinese ship damaged Baltic pipeline on purpose, Finland says",,worldnews
1702664790.0,"IDF troops mistakenly opened fire and killed three hostages during Gaza battles, spokesman says",,worldnews
1686509825.0,"Exodus of scientists from Russia has passed 50,000 since 2018 as more pack their bags to go",,worldnews
1697358110.0,Hamas seen blocking evacuation routes in Gaza - IDF,,worldnews
