created_utc,title,self_text,subreddit
1686692283.0,Putin admits Russia doesn’t have enough weapons and drones,,worldnews
1704746811.0,United Airlines find loose bolts on plug doors of at least five aircraft during Boeing 737 Max 9 inspections,,worldnews
1699314124.0,Zelensky confirms destruction of major Russian warship,,worldnews
1684334835.0,The European Commission has confirmed that anti-LGBTQ+ zones in Poland can “kiss their EU funding goodbye” if they continue to enforce LGBT-free zones.,,worldnews
1686436775.0,US confirms China has had a spy base in Cuba since at least 2019,,worldnews
1682213611.0,Lithuanian Foreign Minister on Chinese ambassador's doubts about sovereignty of post-Soviet countries: This is why we do not trust China,,worldnews
1685643421.0,"5,000 New Species Identified at Site of Planned Deep-Sea Mine",,worldnews
1687807980.0,Putin says Wagner mutineers can join army or 'go to Belarus',,worldnews
1701349602.0,Putin is urging women to have as many as 8 children after so many Russians died in his war with Ukraine,,worldnews
1686665385.0,France uncovers major disinformation campaign by Russia,,worldnews
1684059493.0,Lukashenko does not appear at Belarusian National Flag Day celebration,,worldnews
1687000073.0,"Nato meeting fails to approve first defence plans since Cold War, Turkey blamed",,worldnews
1682440178.0,"Sweden launches research rocket, accidentally hits Norway",,worldnews
1684242193.0,Ukraine officially joins NATO cybercentre,,worldnews
1681643688.0,Germany ends nuclear era as last reactors power down,,worldnews
1708987689.0,France's Macron says sending troops to Ukraine cannot be ruled out,,worldnews
1694777426.0,American Bully XL dog set to be banned in the United Kingdom,,worldnews
1692900918.0,'Catastrophic loss’: Huge colonies of emperor penguins saw no chicks survive last year as sea ice disappears.,,worldnews
1700563476.0,Zelensky says he's survived 'five or six' assassination attempts by Putin's forces,,worldnews
1700362873.0,"By supporting Ukraine, we're keeping American troops out of the war – US President",,worldnews
1692287283.0,"The entire capital city of Canada's Northwest Territories has been ordered to evacuate as hundreds of wildfires scorch the region, officials say | CNN",,worldnews
1707414512.0,Polish leader says US Republican senators should be ashamed for scuttling Ukrainian aid,,worldnews
1681761980.0,CBC says it is ‘pausing’ its use of Twitter,,worldnews
1683925938.0,"Russia tried to destroy US-made Patriot system in Ukraine, officials say | CNN Politics",,worldnews
1709733793.0,Cancer vaccine for dogs almost doubles survival rates in clinical trial,,worldnews
1711185587.0,Russia arrests suspected attackers after mass shooting kills 93 at concert,,worldnews
1688839893.0,US official says 'exiled' Wagner boss Prigozhin may not have gone to Belarus at all — and may have used a body double to make it appear as though he fled Russia,,worldnews
1689362692.0,Putin wants to attend an August summit. Host country South Africa doesn't want to have to arrest him,,worldnews
1711129506.0,"Gunmen in combat fatigues open fire at Moscow concert hall, Russian news agencies say",,worldnews
1696697848.0,Israel will cut off its supply of electricity to Gaza: Energy minister,,worldnews
1687606706.0,Prigozhin Says Wagner Won’t Surrender After Putin’s Address,,worldnews
1708876761.0,"31,000 Ukrainian troops killed since the start of Russia's full-scale invasion, Zelenskyy says",,worldnews
1687016022.0,Google claims it caught China government hackers redhanded breaking into hundreds of networks around the world,,worldnews
1686572312.0,"US decides to rejoin UNESCO and pay back dues, to counter Chinese influence",,worldnews
1683730358.0,Putin announces call up of Russians to military training camps,,worldnews
1708404220.0,"North Korean Workers in China Riot over Unpaid Wages; 2,000 Occupy Factory, Kill Plant Manager",,worldnews
1697482268.0,Terrorist Attack In The Center Of Brussels: Two Dead And Several Injured,,worldnews
1700650145.0,Pope invited trans women over for a pasta & meatballs dinner,,worldnews
1681154752.0,Russia violating international law by not allowing consular access to WSJ reporter -U.S. State Dept,,worldnews
1687954670.0,Zelenskyy: We should finally legalise cannabis-based medicine,,worldnews
1689184057.0,Italian uproar over judge's 10-second groping rule,,worldnews
1685479310.0,US bombers fly over Bosnia in sign of support amid continued secessionist threats,,worldnews
1697408036.0,President Abbas says Hamas actions do not represent Palestinians,,worldnews
1698603941.0,Russians storm airport in attempt to attack passengers of Israeli flight,,worldnews
1681797855.0,China’s defense minister lauds Putin for ‘promoting world peace’,,worldnews
1684318215.0,Global warming set to break key 1.5C limit for first time,,worldnews
1699845179.0,"Berlin criminalizes slogan 'From the River to the Sea, Palestine will be free'",,worldnews
1702728417.0,"IDF: Hostages were shirtless, waving white flag when soldiers opened fire",,worldnews
1704094612.0,Tsunami warning issued as magnitude 7.4 earthquake hits Japan,,worldnews
1684164094.0,"Denmark's mystery tremors caused by acoustic waves from unknown source, officials say",,worldnews
1698071503.0,"IDF shows foreign press raw Hamas bodycam videos of murder, torture, decapitation",,worldnews
1684917858.0,"West is ready to support Ukraine for years, Russia shouldn't expect to wait us out – UK PM",,worldnews
1711047604.0,China building military on 'scale not seen since WWII:' US admiral,,worldnews
1709477326.0,"Swiss vote: ‘yes’ to higher pensions, ‘no’ to retiring later ",,worldnews
1697620139.0,Biden says hospital blast in Gaza ‘appears as though it was done by the other team’ and not Israel,,worldnews
1687377091.0,"Vladimir Putin is 'second king of antisemitism after Hitler,' says Zelensky",,worldnews
1697165129.0,Israel tells UN to evacuate the northern Gaza Strip within 24 hours,,worldnews
1695045125.0,Musk’s Tweet Criticizing Ukraine’s Counteroffensive Sparks Outrage,,worldnews
1685113180.0,"In Russia, children will be sent to patriotic camps and taught to shoot and fly UAVs",,worldnews
1693046559.0,Top US general says Ukrainian forces have broken through Russian main lines of defense in some areas,,worldnews
1690730897.0,Zelenskiy Warns 'War' Coming To Russia After Drone Attack Closes Moscow's Vnukovo Airport,,worldnews
1681855284.0,US warns Russia not to touch American nuclear technology at Ukrainian nuclear plant,,worldnews
1699363516.0,"Waving white flags, Gaza civilians evacuate through humanitarian corridor secured by IDF tanks",,worldnews
1688471590.0,‘You can never become a Westerner:’ China’s top diplomat urges Japan and South Korea to align with Beijing and ‘revitalize Asia’,,worldnews
1695066056.0,Intelligence suggests agents of India behind killing of B.C. Sikh leader: Trudeau,,worldnews
1690924124.0,"Iran's official in-charge for enforcing hijab, chastity caught having gay sex on camera, fired",,worldnews
1683575483.0,Mexican president backs US dollar as world’s principal currency,,worldnews
1709658103.0,"Gangs in Haiti try to seize control of main airport as thousands escape prisons: ""Massacring people indiscriminately""",,worldnews
1706458628.0,"Three US troops killed in drone attack in Jordan, at least two dozen injured",,worldnews
1682615970.0,PACE recognises deportation of Ukrainian children to Russia as genocide,,worldnews
1683067549.0,"Ukrainian Defence Minister suggests that Russia is preparing new ""goodwill gesture""",,worldnews
1681833759.0,Russian national basketball team banned from participation in Olympics,,worldnews
1696332325.0,Ukraine war: Burger King still open in Russia despite pledge to exit,,worldnews
1698671178.0,Far-right German politician arrested after ‘Sieg Heil’ salutes heard,,worldnews
1708804468.0,Prime Minister Justin Trudeau says ’weakling’ Putin executed Navalny to crush dissent,,worldnews
1692992944.0,Wagner Group cemetery in Russia levelled to the ground,,worldnews
1688921706.0,"The founder of Peru’s Pro-Family Pro-Life Movement has been accused of systematically abusing his daughter. She gave birth in 2003, when she was only 13-years-old",,worldnews
1685623758.0,"Moscow does not have a ‘veto against NATO enlargement,’ NATO’s Stoltenberg says",,worldnews
1692170089.0,Booing and walkouts after the Killers tell Georgia audience Russian is their ‘brother’,,worldnews
1685257461.0,"More than half of voters now want Britain to forge closer ties with the EU, poll reveals",,worldnews
1682779967.0,Japan approves abortion pill for the first time,,worldnews
1708954056.0,"Russia’s 2024 election interference has already begun: Moscow is spreading disinformation about Joe Biden and other Democrats to lessen U.S. military aid to Ukraine and U.S. support for NATO, former U.S. officials and cyber experts say",,worldnews
1683293676.0,Ukraine’s forces destroy Wagner ammunition storage points on Bakhmut front – Deputy Defence Minister,,worldnews
1695333626.0,Canada has Indian diplomats' communications in bombshell murder probe: sources | CBC News,,worldnews
1681324002.0,Putin Personally Approved Arrest of US Reporter on Spying Charges,,worldnews
1688234971.0,Russians cremate their dead without keeping record to not pay compensation – General Staff,,worldnews
1681840658.0,Germany announces delivery of Patriot air defence system to Ukraine,,worldnews
1712049129.0,"Major Russian refinery hit by Ukrainian drone 1,300 km from the front lines",,worldnews
1687873226.0,"Russia Executed 77 Civilian Detainees in Ukraine – Russia summarily executed 77 civilians being held in arbitrary detention during its invasion of Ukraine — killings which constitute war crimes, the United Nations said Tuesday.",,worldnews
1687897770.0,"US targets Wagner Group over gold in Africa, days after mutiny",,worldnews
1711353552.0,Three Moscow terror attack suspects plead guilty after 'being tortured',,worldnews
1699325717.0,Orcas sink another boat in Europe after a nearly hour-long attack,,worldnews
1687073678.0,Evidence suggests Russia blew Kakhovka dam in Ukraine - New York Times,,worldnews
1693515393.0,Top Russian Rocket Scientist Suspiciously Dies Weeks After Failed Moon Landing,,worldnews
1687251633.0,Historic decision: Estonia legalizes same-sex marriage,,worldnews
1681130619.0,Official: Kidnapped Ukrainian children punished for refusing to sing Russian national anthem,,worldnews
1686022519.0,Nova Kakhovka dam in Kherson region blown up by Russian forces - Ukraine's military,,worldnews
1691404325.0,"Woman arrested in plot to assassinate President Volodymyr Zelenskyy, Ukraine says",,worldnews
1688151160.0,Billionaires ‘disappointed’ after superyachts banned from Naples port,,worldnews
1680886588.0,British Firm Ships $1.2 Billion of Electronics to Russia Despite Sanctions,,worldnews
1693995857.0,Russia Announces ‘Tactical’ Withdrawal From Ukraine’s Robotyne,,worldnews
1696516700.0,Putin repeats assertion that Russia did not start war in Ukraine,,worldnews
1710097994.0,US prepared for ''nonnuclear'' response if Russia used nuclear weapons against Ukraine – NYT,,worldnews
1712017481.0,Mayor shot dead while at restaurant with his 14-year-old son in Mexico,,worldnews
1688678130.0,Deforestation in Brazil's Amazon drops 34% in first half 2023,,worldnews
1696609126.0,US tourist destroys 'blasphemous' Roman statues at the Israel Museum,,worldnews
1692412980.0,Biden to sign strategic partnership deal with Vietnam in latest bid to counter China in the region,,worldnews
1682600119.0,Turkey's Erdogan falls ill on TV and cancels election rallies,,worldnews
1682083196.0,"All Nato members have agreed Ukraine will eventually join, says Stoltenberg | Nato",,worldnews
1690264008.0,"""Russia is preparing an operation in the Black Sea under a foreign flag,"" - US State Department",,worldnews
1681601075.0,Russian oil exports back above pre-Ukraine war levels as India and China buy 90%,,worldnews
1707007290.0,Russia Has Massed 500 Tanks For An Attack On Kupyansk. Thousands Of Ukrainian Drones Await Them.,,worldnews
1684848134.0,Russia's Wagner Group accused of using rape and mass-murder to control an African gold mining town,,worldnews
1704703820.0,Australia bans Nazi salute and public display of terror group symbols,,worldnews
1688587160.0,"Prigozhin arrives in St Petersburg, takes back seized weapons",,worldnews
1707894915.0,"Russian landing ship Caesar Kunikov hit in Black Sea, it has sunk – intelligence sources, photo, video",,worldnews
1684617247.0,Armed Forces of Ukraine say Prigozhin wants to flee Bakhmut because Wagner Group is broken,,worldnews
1682197758.0,"Kenyan cult leader told followers to starve themselves, at least 21 dead",,worldnews
1702298007.0,"US will ‘lose face before world’ if it abandons Kyiv, says ex-Ukraine president",,worldnews
1694490910.0,George W. Bush says it was 'shocking' to learn that Yevgeny Prigozhin once served him dinner in St. Petersburg: 'All I know is I survived',,worldnews
1687667279.0,"Canadians will no longer have access to news content on Facebook and Instagram, Meta says",,worldnews
1685304066.0,Belarus official: West left us no choice but to deploy nuclear arms,,worldnews
1700079247.0,Iran tells Hamas it will not enter the war with Israel,,worldnews
1708025793.0,White House confirms US has intelligence on Russian anti-satellite capability,,worldnews
1692820530.0,White House says 'no one should be surprised' if Prigozhin actually died in a plane crash in Russia,,worldnews
1694031808.0,Mexico’s Supreme Court decriminalizes abortion nationwide,,worldnews
1686585422.0,Zelenskyy signs law recognising 8 May as Day of Remembrance and Victory over Nazism,,worldnews
1708346640.0,Biden administration is leaning toward supplying Ukraine with long-range missiles,,worldnews
1696767127.0,Israel estimates over 600 dead; troops in firefights with terror squads in south,,worldnews
1681630981.0,S. Korea fires warning shots after N. Korean patrol boat crosses maritime border,,worldnews
1690820640.0,Niger has suspended the export of gold and uranium to France this Sunday with immediate effect,,worldnews
1708517105.0,The UK freezes assets of six Russian prison bosses in charge of the Arctic penal colony where opposition leader Alexei Navalny died,,worldnews
1709227340.0,Ukrainian veterans reject award after church annuls gay soldier’s medal,,worldnews
1701619619.0,The Pentagon says a US warship and multiple commercial ships have come under attack in the Red Sea,,worldnews
1683424929.0,Italy calls crisis meeting over surging pasta prices,,worldnews
1700221667.0,Dog Meat Consumption Set to Be Banned in South Korea,,worldnews
1692218415.0,"Russia confirms it hit Swedish plant in Lutsk, saying it was a military target",,worldnews
1689994932.0,US Citizens Will Need Visa To Travel To Europe in 2024,,worldnews
1708255025.0,Prime Minister: Denmark to supply all its artillery to Ukraine,,worldnews
1707596146.0,Biden Likens Failure to Grant Ukraine Aid to ‘Criminal Neglect’,,worldnews
1693779786.0,Russian pilot who transferred to Ukraine calls on Russians to follow his example,,worldnews
1692885246.0,Prigozhin’s Body Identified in Morgue by Missing Finger: Report,,worldnews
1685333140.0,"Wagner boss attacks Russia's defense minister, says his daughter and son-in-law live in luxury while thousands are sent to die in Ukraine",,worldnews
1707385311.0,Putin challenger says he is barred from election,,worldnews
1706478319.0,Biden says US 'shall respond' after drone strike by Iran-backed group kills 3 US troops in Jordan,,worldnews
1691264166.0,Air-raid warning was announced all over Ukraine due to launch of missiles including cruise missiles from belarus,,worldnews
1690854527.0,Same Moscow skyscraper hit in new drone attack,,worldnews
1695288589.0,South Korea says it 'will not stand idly by' if North Korea receives Russian help on nuclear weapons,,worldnews
1709143710.0,Ghana passes bill making identifying as LGBTQ+ illegal,,worldnews
1702736731.0,Mariupol doctor who betrayed wounded Ukrainian soldiers to Russians is sentenced to life in prison,,worldnews
1689336497.0,"After Quran burning, Sweden okays Bible burning in front of Israeli embassy",,worldnews
1691751202.0,"Ukraine Issues Warning to Moscow Residents: ‘Expect More, Daily Attacks’",,worldnews
1697200959.0,"Irish Prime Minister says Israeli actions in Gaza ""not acceptable""",,worldnews
1680949535.0,"Iran installs cameras in public places to identify, penalise unveiled women",,worldnews
1689681486.0,Extreme heat radiates around the globe as 50C recorded in US and China,,worldnews
1691343159.0,"U.S. Navy destroyers dispatched to Aleutians after Chinese, Russian vessels spotted nearby",,worldnews
1693493236.0,"Zelenskyy says Ukraine has developed a long-range weapon, a day after a strike deep inside Russia",,worldnews
1694929125.0,Apple informs journalists Russia is targeting them with Pegasus spyware,,worldnews
1681165125.0,Vietnam to introduce landmark new bill making it easier for trans people to change gender,,worldnews
1689070344.0,NATO decision on moving towards Ukraine’s membership to be agreed in few hours – Secretary General,,worldnews
1693382107.0,Russia has 'right to war' with 'each and every' NATO country - Medvedev,,worldnews
1689807787.0,"60,000 tonnes of agricultural products destroyed by Russian missiles were to be sent to China – Zelenskyy",,worldnews
1699047827.0,Israel admits airstrike on ambulance that witnesses say killed and wounded dozens | CNN,,worldnews
1695389968.0,"Putin’s war machine risks running out of fuel, so Russia is banning the export of gasoline and diesel",,worldnews
1711196845.0,US has evidence that ISIS is behind terrorist attack near Moscow and warned Russia in advance,,worldnews
1696969135.0,US says it is talking to Israel about safe passage for Gaza civilians,,worldnews
1694693136.0,Ukrainian Bombers Firing Western Cruise Missiles Have Knocked Out A Russian Submarine,,worldnews
1711718724.0,"Islamic State calls on followers to attack Christians and Jews in US, Europe, Israel",,worldnews
1710785247.0,Senior Hamas commander killed in Al Shifa raid ,,worldnews
1697451882.0,Red Cross demands Hamas grant immediate access to hostages held in Gaza,,worldnews
1699192222.0,Iran says US 'will be hit hard' if no ceasefire in Gaza,,worldnews
1686074435.0,Zelensky: Ukraine to receive ‘significant number’ of F-16 fighter jets,,worldnews
1697535563.0,"Jordan’s King Abdullah on Gaza: 'No refugees in Jordan, no refugees in Egypt'",,worldnews
1693918144.0,French state schools turn away dozens of girls wearing Muslim abaya dress,,worldnews
1697741804.0,"Developing: Security incident involving US Navy destroyer in Red Sea, US official says",,worldnews
1697232874.0,'Top secret' Hamas documents show that terrorists intentionally targeted elementary schools and a youth center,,worldnews
1688556442.0,Russians die under mysterious circumstances in Mariupol – City Council,,worldnews
1699232520.0,The US is quietly arming Taiwan to the teeth,,worldnews
1702395619.0,Ukrainian intelligence attacks and paralyses Russia’s tax system,,worldnews
1710855783.0,Mystery in Japan as dangerous streptococcal infections soar to record levels with 30% fatality rate,,worldnews
1689331006.0,Russia withdraws almost all its troops from Belarus – State Border Guard of Ukraine,,worldnews
1709577930.0,Hamas official: 'We don't know which of the hostages are dead or alive' - report,,worldnews
1683144564.0,"Bolsonaro’s vaccine status falsified before he entered U.S., police say",,worldnews
1685744023.0,Scientists Successfully Transmit Space-Based Solar Power to Earth for the First Time,,worldnews
1708534242.0,Russians Who Paid Tribute to Navalny Are Hit With Military Summons,,worldnews
1711212461.0,"Putin seeking to blame Ukraine for Moscow shooting, despite ISIS taking responsibility",,worldnews
1698918715.0,Ukraine Labels Nestle ‘Sponsor of the War’ for Staying in Russia,,worldnews
1710515038.0,EU president congratulates Putin on ‘landslide’ win … as Russian three-day voting begins on Friday,,worldnews
1689710955.0,"Russia extends eligibility for military call-up by at least five years, senior officers to serve up to the age of 70",,worldnews
1695582064.0,President Macron says France will end its military presence in Niger and pull ambassador after coup,,worldnews
1700740150.0,"Putin won’t stop if he takes Ukraine, Pentagon chief warns",,worldnews
1695790819.0,Ukrainian children as young as 4 months old are being forcibly taken to Russia. Officials don't know what is happening to them.,,worldnews
1687229950.0,Biden says threat of Putin using tactical nuclear weapons is 'real',,worldnews
1699882371.0,IDF releases footage of Hamas firing RPG from Gaza City hospital,,worldnews
1694007327.0,"Earth just had its hottest summer on record, U.N. says, warning ""climate breakdown has begun""",,worldnews
1697182954.0,UN Calls Israel Order to Evacuate 1.1 Million in Gaza Impossible,,worldnews
1706702269.0,Iran Warns It Will Retaliate After Biden Says He’s Decided How To Respond To Killing Of 3 U.S. Soldiers,,worldnews
1695221732.0,UN chief calls for an end to $7 trillion in fossil fuel subsidies,,worldnews
1684509252.0,World Bank: A preserved Amazon rainforest is worth $317 billion per year,,worldnews
1682250201.0,"Russia Looking to Recruit 400,000 Volunteers to Fight in Ukraine",,worldnews
1707349233.0,Mexico overtakes China as the leading source of goods imported to US,,worldnews
1688229721.0,"Orca Rams Into Yacht Near Scotland, Suggesting the Behavior May Be Spreading",,worldnews
1703099220.0,"Dutch minister: 'If you don't stop Russia now, they'll go further. It's not just Ukraine'",,worldnews
1703980988.0,"Brexit has completely failed for UK, say clear majority of Britons – poll",,worldnews
1703200053.0,Assad: ‘No evidence six million Jews were killed in the Holocaust’,,worldnews
1698746577.0,Hezbollah mocks Hamas leaders' luxurious lifestyle while Gazans suffer,,worldnews
1698256409.0,Family of Al Jazeera Gaza bureau head killed in Israeli air raid,,worldnews
1711836430.0,"Ukraine faces retreat without US aid, Zelensky says | CNN",,worldnews
1698092257.0,White House says Iran 'actively facilitating' some attacks on US military bases,,worldnews
1689240053.0,Russia Says F-16 Jets in Ukraine Will be Seen as ‘Nuclear’ Threat,,worldnews
1685036516.0,Lukashenko: Russian nuclear weapons are on their way to Belarus,,worldnews
1708584582.0,"Gunmen sent by Moscow killed defector sheltering in Alicante, Spanish intelligence services say",,worldnews
1709118551.0,"French PM asks whether 'Putin's troops are already in our country,' pointing at Le Pen",,worldnews
1687095057.0,"Vienna Pride parade attack foiled, Austrian police say",,worldnews
1684088356.0,Mayors of Istanbul and Ankara cry foul over reporting of Turkey’s election results,,worldnews
1705655895.0,Nato warns of all-out war with Russia in next 20 years,,worldnews
1686081370.0,Tunisian president suggests taxing rich as solution to fiscal problem,,worldnews
1706096242.0,"British public will be called up to fight if UK goes to war because ‘military is too small’, Army chief warns",,worldnews
1704970917.0,"Brexit Erased £140 Billion From UK Economy, London Mayor to Say",,worldnews
1689780934.0,Russia to treat all ships traveling to Ukrainian ports as carriers of military cargo,,worldnews
1683909012.0,Russian troops fall back to ‘defensive positions’ near Bakhmut | Ukraine,,worldnews
1692573689.0,"Russian dam bursts washing away railroad—Economy to lose ""billions""",,worldnews
1696737082.0,Israel asks civilians for help in identifying missing persons - approximately 750 Israelis are currently missing.,,worldnews
1693078261.0,Nicaragua bans Jesuits and seizes all of their assets.,,worldnews
1690448724.0,"Russia declares the International Court of Justice judge who issued Putin’s arrest warrant ""wanted""",,worldnews
1692249084.0,‘No Concept of Political Parties in Sharia’: Taliban Bans Democracy in Afghanistan - News18,,worldnews
1685184099.0,"Russia begins talking about peace again, seeking “recognition of territorial arrangements” and cessation of Ukrainian forces’ actions",,worldnews
1712129367.0,"President Javier Milei fires 24,000 government workers in Argentina: ‘No one knows who will be next’",,worldnews
1710357967.0,Putin does not want war with NATO and will limit himself to “asymmetric activity” – US intelligence,,worldnews
1691075999.0,Poland deploys attack helicopters to border with Belarus,,worldnews
1688502411.0,Russia rigs ZNPP reactor buildings with explosives – AFU,,worldnews
1709234758.0,Chinese retailer caught selling Starlink terminals to Russia,,worldnews
1688496740.0,Climate activists block golf course holes in Spain with seedlings and cement to protest water use | CNN,,worldnews
1687513443.0,Orcas attack Dutch team in Ocean Race,,worldnews
1690142358.0,"Antarctic sea ice levels dive in 'five-sigma event', as experts flag worsening consequences for planet",,worldnews
1680875047.0,Czech government approves plan for regulated cannabis market,,worldnews
1704294186.0,"NATO to buy 1,000 Patriot missiles in face of Russia threat",,worldnews
1690405314.0,Zelenskyy advises Russians leave Crimea while Kerch Bridge is somehow still functioning,,worldnews
1712171624.0,IDF chief apologizes as details emerge of strike that picked off Gaza aid cars one by one,,worldnews
1681245538.0,Ukrainian hackers say they have compromised Russian spy who hacked Democrats in 2016,,worldnews
1684854437.0,France bans short-haul domestic flights in bid to reduce carbon emissions,,worldnews
1682857189.0,"U.S. Navy P-8 Flies Over Taiwan Strait, Causing China to Scramble",,worldnews
