,created_utc,title,self_text,subreddit
0,1719432170.0,"Bolivian president says ""irregular"" military deployment under way in capital, raising coup fears",,news
1,1719432023.0,"He flipped off a trooper and got charged. Now Vermont is on the hook for $175,000",,news
2,1719430254.0,"8 arrested men with ties to ISIS feared to have been plotting potential terrorist attack in U.S., sources said",,news
3,1719428455.0,New Jersey mother accused of killing her two toddlers,,news
4,1719425815.0,UAE says it succeeded in mediating an exchange of 180 prisoners of war between Russia and Ukraine,,news
5,1719425697.0,"Finland to start bird flu vaccinations for humans, in world first",,news
6,1719418051.0,Supreme Court wipes out anti-corruption law that bars officials from taking gifts for past favors,,news
7,1719413305.0,Biden pardons those convicted of gay sex under old military laws,,news
8,1719411617.0,The Supreme Court rules for Biden administration in a social media dispute with conservative states,,news
9,1719408382.0,"21 million Miniverse toy sets recalled due to danger of skin burn, eye and respiratory irritation | CNN Business",,news
10,1719406772.0,"Flatulent cows and pigs will face a carbon tax in Denmark, a world first",,news
11,1719400142.0,Two US astronauts stranded in space on board Boeing’s Starliner capsule,,news
12,1719396194.0,WikiLeaks founder Julian Assange returns to Australia after US legal battle ends,,news
13,1719383533.0,VW to invest up to $5bn in Tesla rival Rivian,,news
14,1719372518.0,NTSB chair says Norfolk Southern interfered with derailment probe after botching vent-and-burn call,,news
15,1719369568.0,"NCAA council votes to remove cannabis from banned drug list, removes limits on on-field coaches",,news
16,1719358392.0,Puerto Rico sues former officials accused of corruption to recover more than $30M in public funds,,news
17,1719357424.0,Entire Bakersfield chapter of Hells Angels arrested in multi-agency investigation,,news
18,1719350958.0,"Tesla is recalling the Cybertruck again, this time because a piece can fly off",,news
19,1719350534.0,"Police fire on demonstrators trying to storm Kenya parliament, several dead",,news
20,1719349415.0,The Ministry of Foreign Affairs has announced the success of mediation efforts by the UAE regarding the exchange of war captives between the Russian Federation and the Republic of Ukraine to release 180 captives.,,news
21,1719349142.0,Exploding batteries spark deadly S Korea factory fire,,news
22,1719345621.0,Nation’s first publicly funded religious charter school blocked by Oklahoma Supreme Court,,news
23,1719337932.0,"Judge alters Trump’s gag order, letting him talk about witnesses, jury after hush money conviction",,news
24,1719331448.0,Judge halts further student loan forgiveness under part of Biden's debt relief plan,,news
25,1719337085.0,Hillsborough County Florida has confirmed case of locally transmitted dengue fever,,news
26,1719335308.0,CT religious vaccine exemption ban will hold; SCOTUS rejects case - CTMirror,,news
27,1719330793.0,Part of Kenya’s parliament on fire as thousands of protesters enter,,news
28,1719327568.0,NASA calls off spacewalk after spacesuit water leak,,news
29,1719319980.0,Apple supplier Foxconn rejects married women from India iPhone jobs,,news
30,1719319326.0,"Israel's high court orders the army to draft ultra-Orthodox men, rattling Netanyahu's government",,news
31,1719318615.0,International Criminal Court issues war crimes arrest warrants for Russia’s Shoigu and Gerasimov,,news
32,1719317083.0,U.S. surgeon general declares gun violence a public health crisis,,news
33,1719294379.0,New Jersey man allegedly flew to Florida to attack fellow gamer: Sheriff,,news
34,1719286499.0,"In San Francisco, Doctors Feud Over ‘Do No Harm’ When It Comes to War Protests",,news
35,1719282146.0,Death of 12-year-old at North Carolina camp for troubled youth ruled a homicide.,,news
36,1719279284.0,"Dali cargo ship leaves Baltimore for Virginia, nearly 3 months after bridge collapse",,news
37,1719274395.0,"Wastewater Surveillance of Chlamydia in Las Vegas Finds Peaks After Holidays, Major Sporting Events",,news
38,1719271208.0,"Julian Assange has reached a plea deal with the U.S., allowing him to go free",,news
39,1719266802.0,"Video shows former Charlotte officer stealing cash from person in custody, chief says",,news
40,1719265229.0,Man dies after being struck by roller coaster at Ohio amusement park,,news
41,1719262186.0,Lawsuit challenges new Louisiana law requiring classrooms to display the Ten Commandments,,news
42,1719257746.0,Bankruptcy trustee discloses plan to shut down Alex Jones' Infowars and liquidate assets,,news
43,1719250293.0,US Record Labels Sue AI Music Generators Suno and Udio for Copyright Infringement,,news
44,1719247790.0,Flooding causes Rapidan Dam near Mankato to fail; nearby residents urged to evacuate,,news
45,1719244224.0,Supreme Court rejects appeals brought by RFK Jr.-founded anti-vaccine group over Covid shots,,news
46,1719240973.0,Hiker missing for 10 days in California mountains survived by drinking a gallon of water each day,,news
47,1719240342.0,Supreme Court will take up state bans on gender-affirming care for minors,,news
48,1719239454.0,"""Legendary waterman"" Tamayo Perry killed in shark attack while surfing off Oahu in Hawaii",,news
49,1719236272.0,A fire at a lithium battery factory in South Korea kills 22 mostly Chinese migrant workers,,news
50,1719233864.0,Honda to end production of mini bikes amid stricter emissions rules - The Mainichi,,news
51,1719231231.0,"Princess Anne, King Charles III's sister, hospitalized with concussion",,news
52,1719231138.0,DC coffee chain lists CEOs and Uber lobbyist as baristas to halt union drive,,news
53,1719220446.0,US prosecutors recommend Justice Dept. criminally charge Boeing,,news
54,1719177769.0,NASA has again delayed Boeing Starliner’s return to Earth,,news
55,1719215216.0,Wildcat Kittens Born Outside Captivity in Cairngorms a ‘Major Milestone’,,news
56,1719193579.0,U.S. fails to ratify ocean mining treaty; other countries rush toward underwater riches ,,news
57,1719192728.0,"More than 15 policemen, several civilians killed by gunmen in Russia's southern Dagestan region",,news
58,1719183606.0,At least 5 dead after missile fragments scatter over beachgoers in Russian-occupied Crimea,,news
59,1719176364.0,"Six intruders run onto 18th green and spray powder, delaying finish of Travelers Championship",,news
60,1719168998.0,"Death toll at Hajj pilgrimage rises to 1,300 amid scorching temperatures",,news
61,1719168812.0,"US Olympic and other teams will bring their own AC units to Paris, undercutting environmental plan",,news
62,1719166973.0,Rapper Foolio killed in Tampa shooting,,news
63,1719144338.0,Eight-year-old pekingese Wild Thang wins World’s Ugliest Dog contest,,news
64,1719137525.0,‘Catastrophic flooding’ in Upper Midwest prompts evacuations as record-breaking heat wave broils the West and mid-Atlantic|CNN,,news
65,1719107405.0,Teen charged as adult in shooting death of 7-year-old boy on Near West Side appears in court,,news
66,1719106957.0,Family of Scientologist Who Took Her Own Life After Self-Immolation Attempt Sues Church for Wrongful Death,,news
67,1719105997.0,A woman is accused of attempting to drown a 3-year-old child in possible hate crime incident|CNN,,news
68,1719099980.0,Police: Vandal spray paints ‘F--- Elon’ on 34 Tesla Cybertrucks in Fort Lauderdale,,news
69,1719099012.0,"Euless woman accused of attempting to drown 3-year-old girl, CAIR alleges hate crime",,news
70,1719096561.0,38 Dogs Saved From Mississippi Lake,,news
71,1719094675.0,‘Multiple disasters all in one day’: New Mexico’s brutal week of fire and flood,,news
72,1719075923.0,"5 men convicted for Jetflicks, illegal streamer with more content than Netflix, Hulu and Amazon combined",,news
73,1719071077.0,"New Colorado law will ban sales of dental floss, clothes, & other household products containing toxic ""forever chemicals""",,news
74,1719063387.0,Britain’s richest family sentenced to jail for exploiting staff in Swiss mansion,,news
75,1719060607.0,Man Exonerated After Spending 45 Years in Virginia Prison for Death of Toddler,,news
76,1719043875.0,Escaped pet donkey found 'living best life' with elk,,news
77,1719040410.0,"Penile cancer: 6,500 amputations in Brazil in a decade",,news
78,1719022130.0,Former state Rep. Mike Horner accused of battery against Osceola school board member,,news
79,1719012151.0,Food stalls shut at Download Festival as fans become unwell,,news
80,1719005535.0,Boater finds $1 million worth of cocaine with bald eagles on it floating in Florida Keys,,news
81,1719003531.0,Nearly 500 confirmed fatalities from Hajj heatwave as hundreds more feared dead,,news
82,1719002739.0,Judge dismisses charges against 6 'alternate electors' in Nevada,,news
83,1718997966.0,"2 killed, 8 wounded in mass shooting outside Arkansas grocery store",,news
84,1718997452.0,Newly released video shows Saudi man filming locations ahead of 9/11 attacks,,news
85,1718990988.0,American Airlines suspends staff after black men kicked off flight - BBC News,,news
86,1718982494.0,"Massive power outage hits Balkan states as heat overloads system, minister says",,news
87,1718981174.0,Pennsylvania couple caught in rip current drowns while vacationing in Florida with 6 kids,,news
88,1718980093.0,The Supreme Court upholds a gun control law intended to protect domestic violence victims,,news
89,1718976742.0,"Man arrested in 13-year-old's rape at Queens park after being spotted, beat up by community, police say",,news
90,1718976103.0,Police chief who lied about naval rank dismissed,,news
91,1718974775.0,"Top Florida law enforcement official sues DeSantis, alleging he was fired for blowing the whistle",,news
92,1718971138.0,Facebook rejects ads promoting stories about climate change under policy on 'sensitive' topics,,news
93,1718951736.0,"FBI raids Oakland mayor's home, several other locations in political corruption probe: source",,news
94,1718934159.0,USC student will not be charged in fatal stabbing of homeless person,,news
95,1718931992.0,"Investigators for 9/11 families examine video taken by man with ties to Saudi intelligence referencing a ""plan"" ",,news
96,1718929629.0,Collecting sex-crazed zombie cicadas on speed: Scientists track a bug-controlling super-sized fungus,,news
97,1718927805.0,This Judge Made Houston the Top Bankruptcy Court. Then He Helped His Girlfriend Cash In.,,news
98,1718918778.0,Roller coaster strikes and critically injures man in restricted area of Ohio theme park,,news
99,1718918354.0,CDK cyberattack shuts down auto dealerships across the U.S.,,news
100,1718917286.0,Judge rules Food Not Bombs Houston can proceed with lawsuit against city,,news
101,1718913922.0,Triple murder suspect in Oklahoma and Alabama killings apprehended in Arkansas,,news
102,1718913208.0,Cargo ship crew members can go home under agreement allowing questioning amid bridge collapse probes,,news
103,1718912906.0,Amazon’s ditching the plastic air pillows in its boxes,,news
104,1718911128.0,Putin signs deals with Vietnam in bid to shore up ties in Asia to offset Moscow's growing isolation,,news
105,1718908472.0,Police arrest Republican lawmaker amid gunshot reports in middle of night in Lansing,,news
106,1718909440.0,Spectrum call center in Charlotte reportedly provided fried chicken and watermelon to employees for Juneteenth,,news
107,1718908405.0,Minivan carrying more than a dozen puppies crashes in Connecticut. Most are OK,,news
108,1718904379.0,"Bird flu threat is low in CT, but experts are monitoring spread",,news
109,1718903857.0,"Donald Sutherland, Don’t Look Now and Hunger Games actor, dies aged 88",,news
110,1718903636.0,"Disney told L.A. residents to move to Florida for a planned campus. They did, it was canceled and now they’re suing",,news
111,1718896668.0,Family of taekwondo instructors saves Texas woman from sexual assault,,news
112,1718892813.0,LAUSD approves cellphone ban as Newsom calls for statewide action,,news
113,1718891603.0,Cargo from 'most ancient' shipwreck found off Israel,,news
114,1718889219.0,Rapper Travis Scott has been arrested in Miami on charges of disorderly intoxication and trespassing. ,,news
115,1718884559.0,Colombian family's genes offer new clue to delaying onset of Alzheimer's,,news
116,1718869310.0,California to return historic amount of land to Native tribe,,news
117,1718868407.0,"Bakersfield man abandons teen at store in rural Butte County, charged with sex crimes",,news
118,1718848587.0,North Korea says deal between Putin and Kim requires immediate military assistance in event of war,,news
119,1718844653.0,Man allegedly sexually assaulting woman in Las Vegas is fatally stabbed after group of citizens intervene,,news
120,1718837400.0,Federal judge blocks Iowa law that allowed the arrest of some undocumented immigrants,,news
121,1718837286.0,Hundreds of Hajj pilgrims reported dead amid extraordinary heat,,news
122,1718830984.0,Former Highland Village fire chief tried to pay undercover officer $120 for sex act: arrest affidavit,,news
123,1718830041.0,The world’s oldest wine has been discovered in Spain with an unexpected extra ingredient,,news
124,1718819774.0,Triple murder suspect on the loose in Arkansas: Police,,news
125,1718815673.0,"Chemicals from East Palestine derailment spread to 16 US states, data shows | Ohio",,news
126,1718810613.0,"Tropical Storm Alberto forms in southwest Gulf, 1st named storm of the hurricane season",,news
127,1718809124.0,Police seek ‘armed and dangerous’ suspect after fatal Washington City shooting,,news
128,1718806743.0,Climate protesters arrested after painting Stonehenge monument orange,,news
129,1718800073.0,Putin and Kim sign mutual defence pact ,,news
130,1718791374.0,Microplastic discovery in penises raises erectile dysfunction questions,,news
131,1718782376.0,"Missing hiker's brother urges increased U.S. involvement in search efforts: ""I just want to find my brother""",,news
132,1718769742.0,Astronauts’ return delayed again as Boeing and NASA try to learn more about spacecraft issues|CNN,,news
133,1718769051.0,"New Mexico village of Ruidoso orders residents to evacuate due to raging wildfires: ""GO NOW""",,news
134,1718759760.0,Baseball legend Willie Mays dies at 93,,news
135,1718759575.0,‘I know it happens’: Boeing chief admits the company has retaliated against whistleblowers,,news
136,1718759349.0,"U.S. halts avocado and mango inspections in a Mexican state after 2 USDA employees attacked, detained",,news
137,1718750683.0,"Boeing hid questionable parts from regulators that may have been installed in 737 Max planes, new whistleblower alleges",,news
138,1718757210.0,Narges Mohammadi: Iran hand Nobel winner fresh jail term - lawyer,,news
139,1718745873.0,Vermont lawmaker apologizes for repeatedly pouring water in her colleague's bag,,news
140,1718743905.0,"Massachusetts 911 call outage Tuesday: Phone calls work again, latest info",,news
141,1718740561.0,Putin arrives in North Korea for first visit in 24 years as anti-West alignment deepens | CNN,,news
142,1718740470.0,"North Texas pastor Robert Morris resigns after admitting to ""inappropriate sexual behavior"" with a minor in the 1980s",,news
143,1718737667.0,2nd-largest school district votes to ban cellphone and social media for students,,news
144,1718738572.0,Club Q mass shooter sentenced to life in prison on federal hate crime charges,,news
145,1718737545.0,Statewide 911 outage reported in Massachusetts,,news
146,1718726803.0,"$25,000 Utah treasure hunt clue unveiled as organizers warn of rattlesnakes",,news
147,1718716839.0,Justin Timberlake arrested for DWI in the Hamptons: Source,,news
148,1718714023.0,"Feds bust dark web marketplace that sold $430 million in fake money, drugs and more",,news
149,1718710581.0,Thailand becomes first South-East Asian country to legalise same sex marriage,,news
150,1718708701.0,British actor Ian McKellen recovering after falling off London stage,,news
151,1718670903.0,US aircraft carrier captain playfully counters Houthi's false online claims of hitting his ship,,news
152,1718663097.0,'Mysterious' monolith similar to column seen in 2020 appears in Las Vegas desert: Police,,news
153,1718638062.0,"German investigators seize cocaine worth 2.6 billion euros, calling it their biggest find ever",,news
154,1718661236.0,Historic SS United States is ordered out of its berth in Philadelphia. Can it find new shores?,,news
155,1718657858.0,Judge orders railway to pay Washington tribe nearly $400 million for trespassing with oil trains,,news
156,1718656028.0,Scripps News Exclusive: Secret Service confirms agent was robbed at gunpoint during Biden's California trip,,news
157,1718655825.0,Russian warships leave Havana's port after a 5-day visit to Cuba,,news
158,1718655203.0,New Jersey Democratic kingmaker George Norcross indicted on racketeering charges,,news
159,1718653914.0,"A fire in Los Angeles County has consumed more than 15,000 acres",,news
160,1718641921.0,4 Florida officers indicted for 2019 shootout with robbers that killed a UPS driver and passerby,,news
161,1718651411.0,Incoming Post editor tied to self-described ‘thief’ who claimed role in his reporting,,news
162,1718650087.0,The ‘Bling Bishop’ Is Sentenced to 9 Years for Fleecing His Flock,,news
163,1718649345.0,Texas surgeon charged with obtaining personal information of pediatric patients,,news
164,1718645867.0,"US sues Photoshop maker Adobe for hiding fees, making it hard to cancel",,news
165,1718637943.0,"Treasury, IRS unveil plan to close ‘major tax loophole’ used by large partnerships",,news
166,1718635595.0,"Maryland Gov. Wes Moore set to issue 175,000 pardons for marijuana convictions",,news
167,1718635562.0,Texas megachurch pastor admits past inappropriate behavior with ‘young lady’ after accusation of molesting 12-year-old,,news
168,1718621612.0,"Greek coastguard threw migrants overboard to their deaths, witnesses say",,news
169,1718614010.0,Indian suspect in plot to kill Sikh separatist extradited to US | CNN,,news
170,1718568118.0,A Chinese military buff inadvertently bought 4 books of military secrets for under $1,,news
171,1718558042.0,"Eight injured in shooting incident during gathering in Methuen, MA",,news
172,1718554083.0,"NASA’s Voyager 1, the most distant spacecraft from Earth, is doing science again after problem",,news
173,1718552679.0,Police officer who twice hit escaped cow with car on suburban street removed from frontline duties while incident investigated,,news
174,1718550314.0,Russian forces kill Islamic State-linked hostage takers at detention centre,,news
175,1718536692.0,Man shot by police after threatening football fans with 'axe and incendiary device' in Euro 2024 fan zone,,news
176,1718528818.0,"Shooting in Detroit suburb injures 9, leaving an 8-year-old in critical condition",,news
177,1718525385.0,"6 people injured in shooting at park in Round Rock, Texas, officials say|CNN",,news
178,1718497554.0,Suspect arrested in 2023 murder of mother of 5 killed while hiking in Maryland,,news
179,1718468020.0,Virginia city repeals ban on psychic readings as industry grows and gains more acceptance,,news
180,1718473220.0,Divers find remains of Finnish WWII plane that was shot down by Moscow with a US diplomat aboard,,news
181,1718491688.0,Brooklands Splashpad shooting: Multiple people injured in Rochester Hills,,news
182,1718484331.0,Missouri woman's murder conviction tossed after 43 years. Her lawyers say a police officer did it,,news
183,1718482425.0,Record-breaking fires consume Brazil’s Pantanal wetland in June,,news
184,1718475022.0,"71-year-old Tampa woman accused of shooting, killing roommate for not cleaning up after himself",,news
185,1718469070.0,A California Law Banning Hidden Fees Goes Into Effect Next Month,,news
186,1718466600.0,Rare tissue-damaging bacteria spreads in Japan,,news
187,1718449857.0,Matija Sarkic: Millwall announce death of goalkeeper aged 26,,news
188,1718423820.0,Crews rescue 28 people trapped upside down high on Oregon amusement park ride,,news
189,1718419233.0,Reported birth of rare white buffalo calf in Yellowstone park fulfills Lakota prophecy,,news
190,1718417829.0,Remains found hidden in Kentucky home of 8-month-old girl missing since April,,news
191,1718392417.0,Abducted Louisiana child found dead and her sister injured after a suspect in their mother’s killing was arrested. - CNN,,news
192,1718391546.0,"Connecticut-sized ""dead zone"" expected to emerge in Gulf of Mexico, potentially killing marine life, NOAA warns",,news
193,1718391157.0,"More US bird flu spread would heighten human infection risk, officials say",,news
194,1718383108.0,Judge approves liquidation of Alex Jones’ personal assets to pay Sandy Hook victims’ families,,news
195,1718377284.0,Former ICU nurse arrested on suspicion of replacing fentanyl with tap water,,news
196,1718374757.0,US Supreme Court backs challenge to federal ban on gun 'bump stocks',,news
197,1718373612.0,Wells Fargo fired a dozen people accused of faking keyboard strokes,,news
198,1718370315.0,"Baltimore's busy port fully reopens after bridge collapse, and a return to normal is expected",,news
199,1718369870.0,"FAA investigating counterfeit titanium used in some Boeing and Airbus jets, NYT reports",,news
200,1718366662.0,"Tennessee sheriff faces 22 charges in 2 counties, accused of profiting from inmate labor",,news
201,1718364718.0,Pentagon ran secret anti-vax campaign to incite fear of China vaccines,,news
202,1718362660.0,Rare century-old wooden water pipe found in Wichita,,news
203,1718346521.0,Double take: 23 sets of twins graduate from a single Massachusetts middle school,,news
204,1718335091.0,"Telehealth CEO charged in alleged $100 million scheme to provide ""easy access"" to Adderall, other stimulants",,news
205,1718329832.0,Texas man charged with threatening FBI agent involved in Hunter Biden investigation,,news
206,1718331233.0,‘The most powerful scream’: Woman dies after being hit by police truck on the beach,,news
207,1718329435.0,State of emergency declared in South Florida as relentless rainfall causes major flooding,,news
208,1718328381.0,AI candidate running for Parliament in the U.K. says AI can humanize politics,,news
209,1718327679.0,Tyson Foods heir suspended as CFO after second alcohol-related arrest,,news
210,1718326899.0,Ex-US Customs officer convicted of letting drug-filled cars enter from Mexico,,news
211,1718316036.0,The FAA is investigating a new incident involving a Boeing 737 Max 8 jet in midair,,news
212,1718313596.0,Elon Musk's investor fan base cheers apparent approval of $56 billion Tesla pay package,,news
213,1718309782.0,Judge says Biden's ban of 'gun show loophole' invalid in 4 states,,news
214,1718306525.0,Ascension says massive cyberattack started after employee clicked malicious file,,news
215,1718302297.0,"Phoenix police have pattern of violating civil rights and using excessive force, Justice Dept. says",,news
216,1718299916.0,"American killed, another injured after being electrocuted in Mexico hot tub incident",,news
217,1718296511.0,US Supreme Court bars 'Trump too small' trademark,,news
218,1718292429.0,Supreme Court backs Starbucks in fight over ‘Memphis 7’ unionizing effort,,news
219,1718288124.0,Unanimous Supreme Court preserves access to widely used abortion medication,,news
220,1718284756.0,Fistfight erupts in Italian Parliament as tensions rise over expanding regional autonomy,,news
221,1718272414.0,"Arizona man planned a mass shooting targeting African Americans at an Atlanta concert to incite a race war, feds say",,news
222,1718272136.0,Sandy Hook survivors graduate from high school,,news
223,1718270642.0,Attorney General Merrick Garland held in contempt of US Congress,,news
224,1718260041.0,NZ takes another step towards digital cash: What you need to know,,news
225,1718255002.0,"Heavy rain and ‘life-threatening flooding’ hit South Florida, prompting the governor to declare an emergency|CNN",,news
226,1718254215.0,DeSantis appointees bury the hatchet with Disney by approving new development deal,,news
227,1718253147.0,Buenos Aires rocked by clashes over President Milei reforms,,news
228,1718245934.0,Antelope at Tennessee zoo chokes to death on plastic snack pouch cap.,,news
229,1718234803.0,"3 deputies shot while responding to northern Illinois home, suspect also wounded | AP News",,news
230,1718219227.0,North Dakota voters pass measure to impose age limits on congressional candidates,,news
231,1718222954.0,9/11 Responders Exposed to More Toxins Show Higher Incidence of Dementia,,news
232,1718221046.0,Southern Baptist Convention condemns IVF procedures,,news
233,1718220254.0,Russian warships arrive in Cuba in show of force,,news
234,1718218827.0,Microsoft changes course on the controversial Windows 11 feature that constantly takes screenshots of your PC's screen: Now you'll have to opt in if you want to use it,,news
235,1718217702.0,98-year-old man whose liver was donated is believed to be oldest American organ donor,,news
236,1718216066.0,Oklahoma Supreme Court dismisses lawsuit of last Tulsa Race Massacre survivors seeking reparations,,news
237,1718214017.0,Elon Musk sued by SpaceX engineers claiming they were illegally fired for raising concerns about alleged sexual harassment and discrimination against women,,news
238,1718211861.0,"Southern Florida receives record rainfall and flash flooding in a 500-to-1,000-year event",,news
239,1718211406.0,Solar project to destroy thousands of Joshua trees in the Mojave Desert,,news
240,1718206079.0,"Jerry West, a 3-time Hall of Fame selection and the inspiration for the NBA logo, dies at 86",,news
241,1718209703.0,Southern Baptists narrowly reject formal ban on churches with any women pastors,,news
