,created_utc,title,self_text,subreddit
242,1718207829.0,Big Oil given stark warning as peak crude and a major supply surplus expected by 2030,,news
243,1718206686.0,US man who drugged daughter and friends at sleepover sentenced to prison,,news
244,1718204672.0,Man charged with selling guns from prison had contact with Buffalo mass shooter Payton Gendron,,news
245,1718198898.0,"Explorer Ernest Shackleton's last ship found off Labrador's south coast, says expedition",,news
246,1718193428.0,Former Trump attorney in Wisconsin suspended from state judicial ethics panel,,news
247,1718189722.0,American investor Martin Shkreli accused of copying and sharing one-of-a-kind Wu-Tang Clan album,,news
248,1718169079.0,"Parents, grandparents of missing Kentucky 8-month-old arrested as police search woods for baby",,news
249,1718164059.0,"1 fatally shot on Atlanta area transit bus that led officers on wild rush hour chase, police say",,news
250,1718153084.0,"""Just dropped in"": Woman recalls falling waist-deep into quicksand at Maine beach.",,news
251,1718150886.0,Southern Baptists expel Virginia church for believing women can serve as pastors,,news
252,1718147433.0,"1 dead, suspect in custody after commuter bus leads Atlanta police on a rush hour chase",,news
253,1718146700.0,Elon Musk drops lawsuit after OpenAI published his emails,,news
254,1718131497.0,Norway discovers Europe’s largest deposit of rare earth metals,,news
255,1718145704.0,"8 suspected terrorists with possible ISIS ties arrested in New York, L.A. and Philadelphia, sources say",,news
256,1718145920.0,"Elizabeth Holmes, Silicon Valley’s most famous convict, makes her long-shot appeal",,news
257,1718143314.0,Fargo woman facing 30 years in prison for bong water,,news
258,1718141061.0,Joey Chestnut banned from Nathan's Hot Dog Eating Contest over apparent partnership with plant-based brand,,news
259,1718135587.0,Waffle House raises worker pay after strikes and pressure from labor organizers,,news
260,1718135312.0,A Florida law blocking treatment for transgender children is thrown out by a federal judge,,news
261,1718133039.0,"4 people reportedly shot at food court in downtown Atlanta, mayor says",,news
262,1718131605.0,Adult entertainment industry sues again over law requiring pornographic sites to verify users' ages,,news
263,1718129849.0,Kite surfer rescued from remote California beach rescued after making 'HELP' sign with rocks,,news
264,1718128426.0,"Part of Wyoming highway collapses in landslide, blocking crucial transit route",,news
265,1718119194.0,"President Joe Biden's son, Hunter Biden, is convicted of all 3 felonies in federal gun trial",,news
266,1718119450.0,US jury holds banana giant Chiquita liable for financing Colombia paramilitaries,,news
267,1718112020.0,"In sweeping change, Biden administration to ban medical debt from credit reports",,news
268,1718104720.0,"Malawi's vice president and 9 others have died in a plane crash, the president says",,news
269,1718084476.0,‘She took everything from us’: Father of 3-year-old murdered at North Olmsted Giant Eagle speaks in court,,news
270,1718084265.0,This Tucson homeowner didn't know his house was built on a cemetery — until he found bones,,news
271,1718076323.0,Washington man allegedly kills teen because he mistook an airsoft gun for a real firearm,,news
272,1718069630.0,"Violent crime is down and the US murder rate is plunging, FBI statistics show | CNN",,news
273,1718064840.0,4 Cornell College staff members stabbed in China,,news
274,1718060985.0,California socialite sentenced to 15 years to life for 2020 hit-and-run deaths of two young brothers,,news
275,1718039307.0,In the doghouse: A member of Santa Fe's K-9 unit is the focus of an internal affairs investigation,,news
276,1718046663.0,Microplastics found in every human semen sample tested in study,,news
277,1718042084.0,Newfoundland woman was 'living in fear' in a for-profit shelter. She was killed there,,news
278,1718052186.0,6-year-old girl killed by badminton racket while vacationing with family in Maine,,news
279,1718041007.0,Apple expected to enter AI race with ambitions to overtake the early leaders,,news
280,1718038823.0,Malawi vice-president's plane goes missing,,news
281,1718035974.0,5-year-old surprised to learn liver donor is his former preschool teacher,,news
282,1718032111.0,"Boys, 12, found guilty of machete murder",,news
283,1718031439.0,Hungry giraffe lifts toddler out of truck at drive-thru safari,,news
284,1718028583.0,3 swimmers attacked by sharks off Florida Panhandle,,news
285,1718019084.0,Martha's Vineyard is about to run out of pot. That's led to a lawsuit and a scramble by regulators,,news
286,1717970918.0,France’s Macron Dissolves National Assembly After Le Pen Victory in European Vote,,news
287,1717959551.0,A real nut case: Cold Stone Creamery faces suit over lack of real pistachios in pistachio ice cream,,news
288,1717953120.0,Employee dies in machinery mishap at food processing plant,,news
289,1717954455.0,Missing mother found dead inside 16-foot-long python after it swallowed her whole in Indonesia,,news
290,1717921514.0,Michael Mosley: body found in search for missing TV doctor,,news
291,1717899477.0,"Carbon dioxide levels in the atmosphere are surging ""faster than ever"" to beyond anything humans ever experienced, officials say",,news
292,1717898582.0,"Purported neo-Nazis rally at South Dakota State Capitol, march around Pierre",,news
293,1717891146.0,Vancouver's nude beach users decry removal of 'privacy' logs,,news
294,1717872135.0,"Israel says 4 hostages, including Noa Argamani, rescued in Gaza operation",,news
295,1717886555.0,Phoenix turns to ice-filled body bags to treat heatstroke as US south-west bakes,,news
296,1717879756.0,Scientists map one of Earth’s top hazards in the Pacific Northwest,,news
297,1717880015.0,New Mexico Police Arrest An 11-Year-Old Boy On Allegations Of A Month Long Crime Spree.,,news
298,1717870593.0,Oregon closes more coastal shellfish harvesting due to 'historic high levels' of toxins,,news
299,1717867897.0,Cleveland Mississippi Country Club refuses woman entry in event,,news
300,1717854463.0,The Army-Navy Gaza aid pier is back in the beach,,news
301,1717809365.0,Rare Brown Booby bird sighting in southern Indiana ruffles feathers at state park,,news
302,1717807475.0,"Former astronaut William Anders, who took iconic Earthrise photo, has died in Washington plane crash",,news
303,1717788216.0,Pat Sajak takes final spin as host on 'Wheel of Fortune' after 41 years,,news
304,1717786561.0,"US Supreme Court justices disclose Bali hotel stay, Beyoncé tickets, book deals",,news
305,1717786013.0,Bag of cash doesn’t stop jurors from convicting 5 of 7 defendants in $40 million food fraud scheme,,news
306,1717783453.0,"Russian navy vessels to dock in Havana, Cuba insists no threat",,news
307,1717782492.0,"Vermont police department apologizes after visiting students witness simulated robbery, shooting",,news
308,1717780584.0,"U.S. Coast Guard seizes over $63 million worth of cocaine, some from shootout at sea that sank vessel",,news
309,1717776493.0,Connecticut town to pay $100K to settle lawsuit after teacher showed Kendrick Lamar video in school,,news
310,1717772210.0,Netflix to fight $170 million damages claim over ‘Baby Reindeer’ | CNN Business,,news
311,1717769360.0,"Jobs report blows past expectations, displaying resilient strength of US economy",,news
312,1717767124.0,Three Americans in alleged coup attempt appear in Congo military court,,news
313,1717764859.0,"Man, 71, arrested after LAPD finds nearly 3,000 boxes of stolen LEGO sets at his home",,news
314,1717739558.0,"China’s exports grow more than expected in May, up by 7.6%",,news
315,1717728453.0,"Alex Jones agrees to liquidate his assets to pay Sandy Hook families, in move that would end his ownership of Infowars | CNN Business",,news
316,1717725229.0,Supreme Court sides with Native American tribes in health care funding dispute with government,,news
317,1717716734.0,YouTuber Alex Choi charged over stunt where fireworks were shot at Lamborghini from helicopter,,news
318,1717713927.0,Exclusive: Cows infected with bird flu have died in five US states,,news
319,1717710339.0,WWII veteran dies en route to D-Day’s 80th anniversary,,news
320,1717709421.0,Burlington Police Terrified High School Students With Mock Shooting,,news
321,1717708157.0,Evanston’s groundbreaking reparations program challenged by lawsuit from a conservative activist group,,news
322,1717703332.0,"Boeing Starliner docks with ISS, delivering its first NASA crew to space station",,news
323,1717689534.0,"Over 1.2 million rechargeable lights are under recall for fire hazards, following one reported death",,news
324,1717695867.0,"Microsoft, OpenAI and Nvidia investigated over monopoly laws",,news
325,1717692858.0,Judge orders ex-Trump adviser Steve Bannon to report to prison by July 1,,news
326,1717691479.0,The FDA reverses its ban on Juul e-cigarettes,,news
327,1717690844.0,Activists fly K-pop USB sticks into North Korea as ‘poo balloon’ row intensifies,,news
328,1717686285.0,Southern Baptists are poised to ban churches with women pastors. Some are urging them to reconsider,,news
329,1717686216.0,SpaceX soars through new milestones in test flight of the most powerful rocket ever built | CNN,,news
330,1717685354.0,Polish military says that a soldier stabbed last month from behind a barrier at the border with Belarus has died - WTOP News,,news
331,1717682995.0,Suspect in Long Island’s Gilgo Beach serial killings is charged in the deaths of two more women,,news
